tconst,convert_text,genres
tt7710126,night heavy drinking john believes abducted aliens unfortunately one believes thinks alcohol blame,"Drama,Sci-Fi"
tt7339762,mother escapes futuristic compound save son transported desert california past meets reclusive girl together journey future,Sci-Fi
tt7297818,cold sore epidemic sends employees dystopian restaurant inescapable chaos,"Comedy,Drama,Sci-Fi"
tt7241974,secret government program finally permeated society via nanotechnology capable dishing form forced karma need years later ai nanotechnology continues advance nanos agenda,Sci-Fi
tt7236054,artist struggling purpose meets mysterious yet charming stranger becomes entangled twisted attempts relive perfect moment,"Sci-Fi,Thriller"
tt6945500,slow burn insanity small band survivors find spending postmeteoric apocalypse fun house converted bomb shelter,Sci-Fi
tt6391332,events rise immortal immortal control michael body using vessel army control town river cray plans open link town nexus zone free rest fallen shadows prison island allowing come river cray scatter across earth bigger plan shell take place cyrus must try stop immortal opening gateways nexus zone must fight help michael gain complete control back body,"Drama,Sci-Fi"
tt5742712,two lovers fall vampire death cult ritual turns awry detached reality death end beginning sunset river styx surreal thriller downonhisluck metro bus driver named one day meets passenger ashe two embark brief electric romance ashe helps pull waking sleep become tune world people around series ups downs relationship time reality become blurred try work past regrets fears future,"Horror,Sci-Fi,Thriller"
tt5037724,post apocalyptic world st century unified commonwealth struggles restore civilization survivors great plague brutal attack commonwealth outpost galatia sgt chase badham sent desperate mission may turn tide war,Sci-Fi
tt4965146,distressed couple become stranded isolated island get hunted unforeseen forcein effort repair stale relationship john accompanies archaeologist girlfriend amy remote island locate ancient native artifacts discover extremely old cave markings along long lost believed sacred mask disappears strange occurrences happen unleashes mythological creature hunts try escape get island,"Horror,Mystery,Sci-Fi"
tt3962164,dream corporation futuristic thriller government attempting control people sleeping habits madsen plays role antagonist brandon payton runs corporation connected manipulating people dreams,Sci-Fi
tt3458560,archaeological expedition uncovers prehistoric hominid burial site team unexpectedly attacked forced take refuge catacombs unmapped cave one one fall ancient predatordeep woods archaeological expedition verge historic discovery find defense unrelenting predator taking refuge catacombs cave hidden hills tensions escalate team begins descent insanity navigating way winding endless caverns fight survive turns fear real terror begins ancient grounds humans always prey,"Mystery,Sci-Fi,Thriller"
tt3383196,elite team military contractors faceoff super powered government sponsored project aimed suppressing human rights,Sci-Fi
tt3369286,mnemophrenia futuristic drama new psychosis arises advanced virtual reality technology causes people unable distinguish real artificial memoriesthe film explores society affected adapts deal mnemophrenia growing new psychosis still advancing technology see story unfold time eyes three generations family affected involved different ways story explores attitudes mnemophrenia would differ person person across generations going resistance fear acceptance eventually even using benefit pushing humanity towards new evolutionary step,"Drama,Sci-Fi"
tt2728784,sun burns american family gathers end world hopes rescue slowly crumbling also confront long lasting divides amongst,"Drama,Family,Sci-Fi"
tt10384542,two teenage brothers find middle woods first day work isolated pizzeria things seem find realm beyond reason,"Animation,Comedy,Horror"
tt10017502,lost einstein doomsday black hole approaching earth yrs wipe complete solar system young kid santhosh shows extraordinary intelligence worlds top physicists scientists give name young einstein grows developing theory harnessing gravity hope everyone saving earth coming doomsday,"Drama,Sci-Fi"
tt9495224,young programmer begins question reality works adapt fantasy novel video game stefan developing computer game based book bandersnatch novel get make choices determines story opportunity take game tuckersoft software company release however works game life emulates game choices made control stefan appears going insane,"Drama,Mystery,Sci-Fi"
tt8433082,looks like nt plot summaries title yet first contribute click edit page button bottom page learn plot summary submission guide,"Mystery,Sci-Fi,Thriller"
tt6147874,lovecrazed couple future chased back time treacherous underworld betrayed,"Sci-Fi,Thriller"
tt7062868,man attempts recollect life experiencing significant trauma,"Drama,Fantasy,Mystery"
tt9067270,britain humanoid alien lands shores liverpool befriends isolated girl meanwhile instatement twenty five year old xenophobic exactor michael crank new prime minister ensures alien arrival far welcoming,"Drama,Romance,Sci-Fi"
tt6603378,save kingdom army undead group warriors must travel forbidden lands fighting fearsome beasts call dark kingdom homeborn fire magic dragons power immeasurable power could harnessed magister used spawn army fury bloods prince favian zaldah filled anger king xalvador named princess elizabeth next ruler enlisted magister army take control kingdom people stop inform king favian insidious plan princess two knights forming unlikely alliance two katori warrior women quest easy path blocked fury bloods leaving choice traverse dark kingdom land swallows enter,"Adventure,Sci-Fi"
tt7853292,satellite stops communicating indian space agency need bring engineer retirement help fix situationan indian satellite mihira collision course international space center could trigger chain reaction lead global communications blackout team astronauts india prevent movie struggles overcome key role played lead actor varun tej come back self imposed exile make mission possible questions real motives,"Adventure,Drama,Sci-Fi"
tt6245274,goal nt live forever create something leaping events lost cause experienced spiderman must grapple guilt sectioning old friend eddie brock dealing aftermath unchained oscorp peter encounters madam webb ethereal capable warping time spiderman must leap action save world crashing new symbiotic threat,Sci-Fi
tt6193506,jon caine respected lecturer university found missing three months later resurfaced massacred group civilians police cafe apprehended detective inspector aleana sent asylum interrogated criminal psychologist dr melanie surya jon erratic psychotic well deadly traits nt went missing melanie soon learnt existence key jon sudden change behaviour ultimately unlocked secret jon held inside,"Horror,Sci-Fi,Thriller"
tt6769514,years future earth invaded stripped resources recovering drug addict wayward soldier embark mission return child safely parents last general us army team attempt recover derelict ship employ invaders,Sci-Fi
tt9129654,without warning explanation children across country begin receive telepathic transmissions deep outer space warning peril future mankindfrom deep outer space children across country begin receive direct telepathic transmissions image impossible describe secret government military agency seeks weaponize children ability send receive messages telepathically buried within image warning may signify end mankind,Sci-Fi
tt8669354,jacqueline living unfulfilled life doomed marriage chance encounter former classmate rethinks life choices wishes could go back high school doover like christmas miracle jacqueline awakens find high school senior ability change everything,"Comedy,Drama,Family"
tt6068406,mere decade heptigalaxial cosmic eternity war kingdom seven galaxies precipice oblivion evil prince adorastius escaped icy incarceration threatens universe fantastical yet calamitous power imaginable multiverse cries peril beleaguered hero galactic commander helios must forge crew old friends new allies defend sanctity cosmos still tormented shadows past must breathe air smells interstellar combat tranquil glades kelvador perilous crags grindlebar fate history existence rests upon shoulders galaxy lords,"Action,Adventure,Comedy"
tt1977094,ad essex deep space fishing vessel industry giant ambercorp ready make final harvest season ship brushes rare creature mammoth size highly territorial could leviathan killed richard owen father make matters worse vicious band sc avengers intercept transmission infiltrate essex leaving nothing cargo supplies captain makes daring decision venture uncharted territory playing keeps capture creature large black market take,"Sci-Fi,Thriller"
tt4581774,gamble one man desperate retrieve daughter smugglers,Sci-Fi
tt6613952,group friends uncover otherworldly object rural field soon discover holds greater secrets could imagine,Sci-Fi
tt7260038,separated mother family camping trip young boy meets fantastical creature helps find way back home,Sci-Fi
tt5611432,still mourning death mother yearold angela behavioral mental instability issues strives maintain harmony house takes care yearold sister chloe tries keep peace difficult goth yearold sister becca furious father jason pulled school hired grad student gabby homeschool becca starts exhibiting bizarre behavior angela seems notice possessed dark otherworldly force plans something unspeakable chloe,"Horror,Sci-Fi,Thriller"
tt9301884,alien race invades begins brainwash humans carry acts destruction rest humanity must rely untested giant robot save earth,"Action,Adventure,Sci-Fi"
tt4633694,teen miles morales becomes spiderman reality crossing path five counterparts dimensions stop threat realitiesmiles morales new york teen struggling school friends top new spiderman comes across peter parker erstwhile saviour new york multiverse miles must train become new protector cityphil lord christopher miller creative minds behind lego movie jump street bring unique talents fresh vision different spiderman universe groundbreaking visual style first kind spiderman tm spiderverse introduces brooklyn teen miles morales shameik moore limitless possibilities spiderverse one wear maskmiles morales teen brooklyn struggling issues adjusts new school top must carry mantel spiderman meets various different versions iconic superhero different forms different dimensions across universepeter parker spiderman except spidermen multiverse known spiderverse downonhisluck teenager miles morales gets bitten radioactive spider sees spiderman stop kingpin dimensioncrossing supercollider killed kingpin afterwards seeing hero die miles vows avenge wallcrawler destroy collider unknown morales another peter parker another dimension,"Action,Adventure,Animation"
tt1571234,postapocalyptic world cities ride wheels consume survive two people meet london try stop conspiracya mysterious young woman hester shaw emerges one stop giant predator city wheels devouring everything path feral fiercely driven memory mother hester joins forces tom natsworthy outcast london along anna fang dangerous outlaw bounty headthousands years civilization destroyed cataclysmic event humankind adapted new way living evolved gigantic moving cities roam earth ruthlessly preying upon smaller traction towns tom natsworthy robert sheehan hails lower tier great traction city londonfinds fighting survival encounters dangerous fugitive hester shaw hera hilmar two opposites whose paths never crossed forge unlikely alliance destined change course futurebased bestselling book philip reeve mortal engines tells story dystopian future cities move wheels across barren earth one day london young scarred girl named hester shaw meets boy named tom natsworthy outcast london accompanied brave antitraction league must stop villainous valentine unfolding plot destroy world,"Action,Adventure,Fantasy"
tt4701182,run year bumblebee finds refuge junkyard small california beach town cusp turning trying find place world charlie watson discovers bumblebee battlescarred brokenon cybertron autobots led optimus prime verge losing great cybertronian war enemies decepticons begin making preparations leave planet decepticons led shockwave soundwave starscream ambush evacuation optimus sends young scout earth order set base operations autobots regroup reaches earth alone crashlanding california disrupting training exercise conducted sector secret government agency monitors extraterrestrial activity earth sector agent colonel jack burns presumes hostile invader attacks driving forest ambushed decepticon blitzwing refuses reveal optimus whereabouts blitzwing spitefully tears voicebox damages memory core manages destroy blitzwing collapsing wounds entering stasis scans transforms yellow volkswagen beetleafter defeated decepticons war cybertron autobot leader optimus prime sends earth establish outpost protect earth surprises training group soldiers command colonel jack burns escapes however ambushed deception damages memory core voicebox defeats enemy transforms yellow volkswagen beetle eighteenyearold charlie watson finds beetle junkyard owner hank gives car teenager great mechanic misses father lives young brother estranged mother boyfriend charlie accidentally activates signal decepticons track earth two decepticons head earth capture destroy autobot convincing dr powell army peaceful enemy dangerous robot meanwhile charlie befriends calls bumblebee,"Action,Adventure,Sci-Fi"
tt9377748,virginia lives house outskirts city finds monica old friend nt seen long time virginia scientist works laboratory set house dismissed job public center research nonetheless whats actually wants use monica volunteer secret experiment contact dimensional beings,Sci-Fi
tt8390370,radio silence select team us army special forces soldiers sent mission retrieve pieces downed us spy satellite remote desert region northern mexico excepting routine even boring mission asking sunday sir encounter sudden loss half team mexican escorts nearly equipment forced retreat foot spend long night hiding local restaurant trying understand survive gear support time,Sci-Fi
tt8318702,passengers train crashes river must decide whether risk waiting help wreckage take chances murky depths,"Action,Adventure,Horror"
tt8041916,young man finds time machine device life spins control,Sci-Fi
tt4418730,natalie boyfriend murdered builds machine change past changing memories fbi agent sister therapist try stop hurts use anything get back,"Drama,Sci-Fi,Thriller"
tt9497146,one year passed since events mobile suit gundam unicorn laplace box opened following conflict called laplace incident neo zeon remnant force known sleeves destroyed banshee unicorn gundam sealed away public consciousness locked secrecy meant forgotten history however sightings another gundam suddenly reported unicorn gundam phenex thought lost since two years ago reappeared,"Action,Animation,Sci-Fi"
tt9290986,cia agent participates secretive braintransference program ambassador italy kidnapped rogue agentwhen american ambassador italy kidnapped rogue us government agent makes demands send president cia scrambling protect mysterious covert government project involving memory transference brain recently scanned hard drive ambassador knowledge international undercover agents becomes hot commodity black market one scientist knowhow implant data another host plethora double agents mix cia dispatches agent john ramsay find secure scientist knowing trust becomes virtually impossible corruption treachery trickle highest levels pulsepounding spy thriller,"Action,Sci-Fi,Thriller"
tt7978752,suicidal businessman visited interdimensional appears form beautiful woman,"Drama,Fantasy,Sci-Fi"
tt8115684,privatelyfunded expedition seeks beat us soviet union race mars intrepid explorers discover changes everything film tribute well sendup classic scifi satirical references come thick fast also serious message woven,"Adventure,Sci-Fi"
tt5080556,dr vaseegaran rajinikanth android assistant nila amy jackson called help mobiles start mysteriously flying hands people chennai vaseegaran summons trusted robot chitti rajinikanth ward birdshaped supernatural powers pakshirajan akshay kumar years chitti dismantled due destruction caused vaseegaran created new human robot nila understand human feelings better cell phones city start disappear everywhere creature form bird creates havoc city causing destruction vaseegaran believes fifth element force decides get chitti back action vaseegaran traces location missing cellphones help chitti nila finds fifth force human force done late professor pakshi rajanwhen mobile phones start mysteriously flying hands people chennai dr vaseegaran android assistant nila called help city threat supernatural powers pakshirajan deadly winged monster seeking revenge mankind harming birds mobile radiation dr vaseegaran forced reassemble robot upgraded version chitti fight pakshirajan save world,"Action,Sci-Fi"
tt9442046,third installment kerion scifi saga new dawn sees rebellion take stand empire,Sci-Fi
tt9034308,desperate wife agrees baby cloned comatose husband dna however husband gets better get rid baby past comes calling decades later mix mystery lust violencejosie devoted wife devastated beloved husband leo falls coma terrible accident desperate child accepts option cloning arrival baby unexpectedly awakens leo unleashing newfound ability experience supernatural visions visions weaken reveal terrible cursed future understand accept confused intensely anxious done josie tries deny created husband reactions grow stronger baby confronts doctor spearheaded experiment fearful man clone coexist baby great danger leo josie forced make impossible choice keep secret forever couple remain together love continuing career thriving twenty years later past comes back haunt truth buried patient dark twisted gothic fairy tale grown ups,"Horror,Sci-Fi,Thriller"
tt1780790,camping trip turns living nightmare blizzard traps four friends inches sudden snow shrieking alien sounds outside tentsa camping trip turns living nightmare blizzard traps four friends inches sudden snow shrieking alien sounds outside tents race life ensues hunted horrific monsters discovering larger alien conspiracy every terrifying stride,"Horror,Sci-Fi,Thriller"
tt1477834,arthur curry humanborn heir underwater kingdom atlantis goes quest prevent war worlds ocean landarthur curry half human half atlantis goes trip lifetime adventure compel come terms real identity also forces discover whether entirely worthy fulfilling destiny becoming kingborn upon shores surface world arthur curry discovers half human half blood atlanteean descent thus making rightful heir throne undersea kingdom atlantis however arthur learns atlantis ruled malicious half brother orm seeks unite seven underwater kingdoms wage war upon surface aid nuidis vulko gorgeous mera arthur must discover full potential true destiny become aquaman order save atlantis surface orm evil plotarthur curry always different mother honorable queen atlantean descent father simple human lighthouse keeper met fled land running forced fiance years later arthur toddler mother forcefully reluctantly taken back atlantis believed executed fast forward arthur adult learning truth destiny sets find king lost trident stop entire war even starts,"Action,Adventure,Fantasy"
tt9318706,young greek photographer boards elevator tall building goes,"Horror,Mystery,Sci-Fi"
tt9341628,mass solar storms causes tsunamis volcanoes flooding citydwelling family attempts flee relative safety group highelevation caves several miles away,"Action,Adventure,Drama"
tt7033092,distant future countries recovering world war iii civilians migrate countries claim new land infants born one towns forever change course time,"Horror,Sci-Fi"
tt8241148,dive deep dystopian innerworld grown men crawl around fours chaos reigns supremea man named bobo haunted demon claiming possession deceased son soul boy named andrew lands job host new conspiracy theory web series also small karate man travels deep underworld battle true evil,"Drama,Horror,Mystery"
tt3833682,hermit farmer discovers late father secret journal containing plans magnetic powered machine could change world unexpectedly becoming custodian gifted year old nephew mom untimely deathgrady lee jr struggling reclusive farmer never wanted married children lost mom young boy time father stepmom died car wreck separating stepsister marry ann randy father best friend took grady raised kept family farm sustained one day grady discovers late father hidden journal contained secrets nikola tesla journal contains plans machine works electromagnetism called jack grady believes could increase productivity drastically reducing time takes plant grow could answer saving farm helping county fact could change world help friend boudreaux begin work device boudreaux native american decent sense change coming grady call attorney grady finds beneficiary late step sister last testament discover custodian nephew special year old boy kai meet kai drawn except grady child distraction would rather keeps jack heart city kai stranger nature mom remembered farm believed would make perfect environment ability nurtured grady discover familial emotions,"Drama,Family,Sci-Fi"
tt1458902,family man struggling hold together discovers hidden parlor offers solution sexbots,"Drama,Fantasy,Sci-Fi"
tt8282980,taking place fifth reality discovered humanity alternate follows inhabitant foreign visitor struggle survive within collapsing ecosysteman abstract exploration st century domesticity eyes foreign documentarian film takes journey goingson peculiar world unnervingly familiar environment begins unravel avantgarde meets nature documentary story adaptation survival,Sci-Fi
tt9192492,pile dead bodies someone wakes end amnesia first stage infection turns humans dried husks flesh hunger led eat corpses bacteriological war north thrown sky south latin american continent dog name given three wild men young girl begins insane bloody race survive,"Action,Horror,Sci-Fi"
tt7961060,goku vegeta encounter broly saiyan warrior unlike fighter faced,"Action,Adventure,Animation"
tt9752158,man appointed pastor church needs god,"Biography,Drama,History"
tt9376096,august world war ii story people gathered place korea gunsan harbor japan occupied day japan surrenders united states,"Drama,Fantasy,History"
tt8991324,lihaaf quilt urdu short story written ismat chughtai published urdu literary journal adabilatif led much controversy uproar obscenity trial ismat defend lahore court well work asked apologize also case lawyer pointed story makes suggestion sexual act prosecution witnesses could point obscene words story suggestive told perspective small girl coming decades widely anthologised became one known works besides angarey remained banned several decades years later mentioned detail court trial noted memoir kaghazi hai pairahan life words memoir though received attention suggestion lesbianism also deals insulated suffocating life neglected wife feudal society became landmark early depiction sex still taboo modern indian literature let alone urdu literature film adaptation story lihaaf author real life experience three years fighting court case challenging freedom speech,"Biography,Drama,History"
tt8979816,mid th century classical east bengal context betrayed fianc young female writer chandrabati exiles inside shiva temple resorts rewrite great indian epic ramayana rebelliously establishing ignored point view sita diminishing iconic hero epic rama,"Drama,History"
tt8841550,dramatised documentary starring rachel griffiths oscar redding examines lives two people etty hillesum franz jaegerstaetter stood ground nazi oppressors europe suffered lives,History
tt8785080,spring summer nearly jews rounded france deported almost die concentration extermination camps without assistance french authorities police operations meticulously prepared nazis would never existed thanks realistic evocative scenes archives photographs unpublished documentary plunges last elements revealed historical research make us live inside waves massive violent arrests,History
tt8781530,often told students politicians point view rarely police perspective using archive documents obtained derogation statutory limitation period years also thanks testimonies officers working point history factual documentary offers different reading may policemen plunged midst unexpected violent tumult,History
tt8685584,one nt like home cookin,"Biography,Comedy,Family"
tt8485448,times freedom speech freedom thought,"Drama,History"
tt6693892,wayward youth given life changing lesson centenarian great grandfather takes sojourn civil war south families rootsa wayward young man begins journey redemption guidance centenarian great grandfather sojourn walking footsteps family progenitor known man without name awakens youth two men juxtaposed literal path life come grips dark shadows confederacy still loom st century afrikans america,"Drama,History"
