tconst,convert_text,genres
tt9313816,set windhoek area today namibia unlikely encounter drama sarcastic humor relational difficulties father son womanizing absent father martin keller sees financial professional universe collapse also confronted equally fragile nature marital life wife joann housewife struggles artistic talent recognized meantime teenage son reacts rebellious way father absence deciding come closet take father chair unexpected arrival enigmatic uncle martin bill keller rekindles hope mending conflicting expectations family triangle sensitive experienced bill however understanding character real needs orchestrate way unexpected outcome amidst contemporary universal family plot story unfolds historical cultural constraints rooted namibian society genocide herero people perpetrated german colonial empire well highlights importance reconciliation,"Drama,Family"
tt9284388,bunch grapes story mother daughter always unique relationship evolves two women characters relationship two complicated never beautiful never toxic created difficulties two mother happy daughters vise versa,"Drama,Family"
tt9050332,story love hate brothers bought wife remote mountainous areas china,"Drama,Family"
tt8991310,jinmu starts record things remember camera hearing could lose memory due prearranged brain surgery memories family forgotten father comes jinmu mind takes records life,"Drama,Family"
tt8974572,middle aged woman bitter tears,"Drama,Family"
tt8890448,life become veritable hell mammali poor barber remote village kerala daughter law shareefa son anwar joined killed fighting life went topsyturvy mammali shareefa life going one used daily visits police station harassment law enforcers rejection friends relatives social boycott life completely changed course actully two hapless victims ensnared vicious net set communalism,"Drama,Family"
tt8870036,project long movie min main role movie frhad yearold living mother yearold sister village call nohooj,"Drama,Family"
tt8792814,wellmeaning naive parents get involved seedy illegal work underbelly tokyo provide young daughter,"Drama,Family"
tt8529310,hongkongers finding way life way living city sadness hong kong,"Drama,Family"
tt8476138,tashi completely independent self funded small budget bilingual feature english hindi shot entirely singapore coproduced singapore india written directed produced awardwinning film maker shilpa krishnan shukla whose previous film pularum iniyum naalekal always tomorrow went film festivals worldwide received awards shilpa also full time marketing director well mom pursues filmmaking passionate hobby third feature film film shot span days member team included cast crew made within total production budget bulk post production done virtually across singapore india tashi explores various facets life focus simple story telling delicate relationships parents children siblings spouses well strangers name film tashi inspired tibetan word meaning auspiciousness,"Drama,Family"
tt8442480,recentlyfired columnist visits family hobart inspired embark writing project closer heartcoming soon fired job writing weekend magazine ted wilson decides take break melbourne visit family hobart realises loss could opportunity chance pursue something meaningful happens idea want write something beautiful cricket piece literary nonfiction sense tasmanian batsmen heart sensing brush greatness may focus reflections ted embarks halfheartedly quixotic search legendary australian cricketer exalted tasmanian david boon yet search stalls ted finds immersed presenttime infinite riches reconnecting widowed mother adult siblings young children denuded narrative fanfare film begins operate unique documentary portrait middle tasmania rare loving commitment warm convivial present featuring remarkable performances cast comprised solely director immediate family cover cloud discovers uniquely australian tranquillity drawing attention throughout grace often hidden plain sight,"Drama,Family"
tt8320292,film background great migration urbanization china film focuses troubles migrant workers life due household registration system household registration system although chinese government allows people rural poor areas move developed large mediumsized cities migrants actually treated fairly children even study city workand schools demolished expelled big cities,"Drama,Family"
tt8152842,two schoolgirls volunteer local radio station glue community ryuji natsuo arrived town manage station looking local stories content programming hear festival called yamaage encountered problems two schoolgirls involved helping situation,Family
tt8123800,religion came build harmonious society ancient hindu religion oldest initiated one person implored way life exploring betterment community scriptures mantr chants rituals strong scientific base meaning understanding losing luster years today youth going global confused basic faith god entity positive energy within demon negative energy without hindu religion based basic natural energies sun wind rain earth space every living made chaos confusion minds today youth devoid concrete strength life film creates story interwoven simple day day life characters try simplify complexities religion religion understood right perspective develops individual mass societal mind simultaneously lost superficially politicizedused selfish gains religion ever preach destruction mankind low understanding executors followers see religion incorrect perspective religion initiates strength every single human outreaching entire society building plane harmony within without journey let today youth understand clearly simplicity binds one us collective strength,"Drama,Family"
tt7813894,five individuals struggling achieve dreams future city,"Drama,Family"
tt7421782,children want become elders soon eat whatever want parents wish children disciplined well mannered parents decide leave town children way want children enjoy freedom like elders end day start missing parents side parents seen worried concerned sticking secession children convince parents come back live happily good,Family
tt7285388,sevenyearold kayla father dies unexpectedly mission us changes kayla life completely takes responsibility broken family inspires people around love singing end manages carve happy life,"Drama,Family"
tt7194914,unexpected injury forces jesse work facing financial crisis mental anguish family must stand together,"Drama,Family"
tt7131338,emotionally broken family moves house haunted tom suffering spirit tom sees opportunity try save soul teaching family live quickly discovers easier said donewhen drunken depressed divorcee tom falls secondstory banister death unknowingly awakens afterlife find things nt changed much angie district ghost manager arrives rules tom death suicide tom told remain home date ghost trial determine sent heaven hell kicker comes angie tells things nt look good redemption good bad marks kept since born running major deficit one thing gives tom hope though accounting good bad continues afterlife way trial,"Comedy,Family"
tt7006612,maybeline divorced woman struggling find discovers sister sharon mother young boys terminally ill maybeline life turn upside takes role never anticipated fighting save young boys,"Drama,Family"
tt6812842,dheblu carrying burdens dead husband along daughter pokchi final journey mountains uribo alongside story putum year old earthquake survivor quest find lost family backthe journey dheblu daughter pokchi mountains uribo carrying burdens dead husband alongside story putum adopted year old earthquake survivor trying find real family back,"Drama,Family"
tt5072612,david mcdoll selfish wealthy man living enviable lifestyle large villa collecting fancy cars however life changed forever inherits six grandchildren glamorous lifestyle quickly becomes complete chaos learn valuable lesson teaches placing family first discovering newfound appreciation life,"Comedy,Family"
tt4718534,vicious assault woman holds fate attacker hands,"Drama,Family"
tt4212984,jimmy yearold boy daydreams world greatest animal trainer unfortunately loss father daydreams take school personal life begin suffer mom sends live grandfather summer thinks things gone bad worse discovers animal sanctuary next door baby white lion learns sanctuary bought evil corporation plans use animals testing formulates plan new found friends stop sale expose company really,Family
tt3380190,ek tha hero inspiring story year old village boy fondly called hero passion cycle dreams cycle someday go roller coaster ride make dream come true succumb failures sets strong example never give emerges real hero,"Drama,Family"
tt3101140,inspired true events shot location new orleans la gemma brown marni wilkins families best friends since babies five marni lost mother left unfulfilled soul devastating loss thankfully best friend gemma family always side ten years later marni opportunity find lost connection mother learns mother favorite poet samantha banks teaching distinguished magnet school arts area two friends excited apply gemma gets accepted however soon learn marni father neglectfully missed registration deadline realizing dreams getting know mother may disappear gemma convinces marni something drastic things nt go quite planned two girls learn valuable lesson race identity politics friendship growing poignant yet tender coming age story,Family
tt2319991,one man struggles drug addiction told eyes person loves little sister,"Drama,Family"
tt0328810,triangle love story viz meher kaushik sen noor saswato chaterjee sakina nandita das film revolved around triangle viz meher kaushik sen noor saswato chaterjee sakina nandita das noor marries sakina soon separates leaves gulf returns lot money wife years meanwhile sakina married meher three children meher somehow manages eke livelihood farming menial jobs noor meher cousins noor employs meher contract jobs skill efficiency meher also earns money processa small story man rose rags riches transition life changes story also revolves around first wife still love unable express due situation life even though married someone else movie expression less words,"Drama,Family"
tt9343826,ananthu advocate belonging orthodox brahmin family falls love nusrath fathima baig muslim girl ananthu wins love plot whole love story revolves court narrated humorous way,"Comedy,Drama,Family"
tt9389924,tells story old man comes gay children senior years take care ailing lover,"Drama,Family"
tt9337248,sisters mary jane mary anne find odds groomtobemary jane toni gonzaga allaround eventwedding organizer meets clients change course monotonous stuck life exboyfriend pete sam milby estranged younger sister mary anne alex gonzaga two persons dear mary jane getting married despite initial hesitation mary jane commitment make sister overcomes uneasiness exboyfriend still big day comes nearer past issues buried emotions begin resurface risking things bind together love family,"Comedy,Drama,Family"
tt9313558,jessica grandmother last wish died family house one last time christmas sold money divided jessica husband mark host family gathering gathering drama anticipation hope grandma left behind special gifts touched deeply revealing hidden family secrets,Family
tt9070794,set mall holiday spectacular tell story estranged family brought back together holiday season cassie wronged shoplifting community service mall rhyme friends vacation leaving attaway bored ends getting job one santas elfs rhyme cassie two different complicated stories meet rest tell brat hourlong movie released late december described written style love actually several interweaving storylines,Family
tt8852130,titanic punjabi feature film family movie titanic based young boy life whose dreams high wants join indian navy unfortunately life completely changed due week financial conditions home starts work low level driving autoriksha works hard faces many obstacles work end accepted vechile submarine himpunjabi feature film titanic based young boy life whose dreams high wants join indian navy unfortunately life completely changed due week financial conditions home starts work low level driving autoriksha works hard faces many obstacles work end accepted vechile submarine,Family
tt8354006,get big promotion hayley advertising executive specializes social media things hip must land toy company traditional christmas accountto get big promotion advertising executive must land toy company traditional christmas client boss points area knows cares little agrees go christmas boot campto get big promotion hayley advertising executive specializes social media things hip must land toy company traditional christmas account boss points area knows cares little haley agrees go christmas camp new england learn everything classic holiday traditions starts work chore takes turn romantic camp owner handsome son shows,"Drama,Family,Romance"
tt8705364,church going negative allegations brought pastor also nt paying taxes pastor estranged sons come together congregation help save church christmas,"Comedy,Family"
tt9165666,tiny young woman trying find belongs journey meets lots different friends name thumbelina story journey finding filled tremendous songs capture imagination,"Family,Musical"
tt8688048,forced live life inhabited wicked step mother two step sisters cinderella perrault learns fruition love life self discovery modern retelling classic tale,Family
tt8291022,london mitchell known scrooge previously lived unscrupulous lifestyle divorcing wife barely seeing children dumping woman month christmas somebody else suddenly london becomes faced diagnosis prostate cancer forces rethink total outlook life christmas holiday,Family
tt9543936,getting ready take part new year magazine school astghik gets acquainted snow maiden promises help even know help free snow maiden captivity another world bring lost letters santa claus friend arthur schoolgirl friends another world,Family
tt9274824,blanca snow faced spending christmas dastardly stepmother victoria attempts fulfill late father wishes create new memories familywhen blanca snow faced spending christmas dastardly stepmother victoria attempts fulfill late father wishes create new memories family however victoria plots edge blanca father inheritance keep money mansion plans renovate house hiring talented designer lucas prince falls love blanca victoria jealous outraged help assistant zane victoria blanca hypnotized forget everyone everything father blanca wakes quaint motor lodge town severe amnesia receives help seven quirky friends holly jollies help figure life attempting regain memory finds object affection house painter hunter lucas prince trust finally remember past stop victoria stealing everything father built,"Comedy,Drama,Family"
tt9248032,two orphan children meet pair unexpected visitors change fortunes lives foreverduring time robber barons mills rising industry two orphan children meet two unexpected visitors turn tide events change lives forever,"Drama,Family"
tt8529070,lives gullible maid beautiful socialite ambitious investment banker happy go lucky chauffeur entwined together dubai bittersweet tale self discovery,"Drama,Family"
tt7748494,mumbai pune mumbai shows gautam gauri marriage life sequel film mumbai pune mumbai gautam gauri enjoying married life focusing careers find gauri unplanned pregnancythey want disclose one news spreads family dr shubhugauri gautam decide abort baby dr shubhu advises discuss familythe overjoyed family annoyed decisionbut gauri prepares go baby gautam still hesitates still ready take responsibility promises learn things,"Family,Musical,Romance"
tt7549618,set st augustine florida bernie dolphin family adventure brother sister befriend badly sunburned dolphin separated family uncover secret plan could destroy beach new friend home kids must devise clever plan stop bad guys protect sea life importantly save best friend bernie,"Action,Comedy,Family"
tt9284242,welcome tiana world totally tiana totally awesome join tiana wilson family behind scenes super successful youtube channels get ready follow epic journey youtube superstardom mum dad side tiana calls shots first ever neverbefore seen feature length video get fun whilst counting tiana top milestone moments sing along brand new music video lol dares pull ultimate prank beat pranks ttsquad sit back get ready totally tiana awesome story,Family
tt7999950,recently separated parents tracie fisk rick rogers spend every holiday young daughters harper ava christmas girls one thing wish lists spend christmas mom dad tracie family farmhouse temporary reunion walk park tracie rick perhaps christmas gathering help rekindle lost romance two make daughters greatest wish come true,"Drama,Family,Romance"
tt7997728,film celebrate th anniversary italian kids tv show zecchino doro explain works organization kids songs competition,Family
tt7093966,election shuffle story year old boy named jeffrey lynn decides run school president along friends suddenly cyber bully trying ruin campaign posting bad message online jeffrey friends find cyber bully stop bad online messages continue election,Family
tt8410932,story mother mitsuko son taiji woman dislikes son boy love mother family turmoil son abide situation leaves home live alone friend informs news inspires man meet mother taiji growing older yet mother still dislikes still taiji trying earn love,Family
tt7474512,first day fourthgrader sune welcomed unwanted surprise new boy seat everything sune wants name also sune worst possible start fourth gradeon first day fourthgrader sune welcomed unwanted surprise new boy seat everything sune wants name also sune worst possible start fourth grade sune must use cunning stop sophie breaking choosing sune hkan notices big brother enter boring adult world dad rudolf midlife crisis wants quit job pursue career music mum karin glares jealously new sune perfect mum even perfect car welcome anderssons,"Comedy,Family"
tt7125260,way home friends party twin brother warren weise drunk jess mussington hit speeding car left deadly injuries including dislocated spine broken leg punctured lung mild amnesia months later released hospital come terms injuries new life help brother warren big sister alexandria weinreb crush dylan delgadobarriero newly divorced parents joe thompson leah kingston,"Drama,Family,Romance"
tt6144460,film tells story young boy finds santa workshop changes completely oldfashion production process ultra modern hitech production line,"Comedy,Family"
tt9113252,coal mines international stardom biographic documentary explores extraordinary colourful life professional wrestler adrian street although destined work alongside father welsh coal mining industry street ideas chase dreams becoming professional wrestler running away brynmawr aged adrian soon became uk youngest professional wrestler international career spanned years street pioneer inspired wrestling world know today also forefront glam rock movement documentary pays homage british pop icon interviews know best including man,Biography
tt8838868,life talented screenwriter tragically broken dream memories friends autobiography remained memories turn film,"Biography,Drama"
tt8507456,vivekananda film aimed spreading irrefutable message swami vivekananda exploring effort ameliorate human race film studies famous trip america phenomenal speech chicago parliament world religions thereafter trace entire american european encounters glorifies indian culture spirituality west investigating swamiji western trip also come know historical characters like sister nivedita mrs mcleod prof wright others film also examines swamiji overarching worldview regarding humanity spirituality piece aims educating informing people swamiji ideas various anecdotes reveal greatness,Biography
tt8359232,gilbert klingel early naturalist explorer chesapeake bay region wrote three books underwater diver built one bay first diving bells later built shipyard gwynn island virginia national geographic underwater photography project klingel titles one hundred hours chesapeake klingel became famous several endevours one building foot boats steel hulls building hand producers biographical film found hundreds photos film bring klingel life work public,Biography
tt8246654,vivekananda feature film aimed spreading irrefutable message swami vivekananda exploring effort ameliorate human race film studies famous trip america phenomenal speech chicago parliament world religions thereafter trace entire american european encounters glorifies indian culture spirituality west investigating swamiji western trip also come know historical characters like sister nivedita mrs mcleod prof wright others film also examines swamiji overarching worldview regarding humanity spirituality piece aims educating informing people swamiji ideas various anecdotes reveal greatness,Biography
tt8070072,donatus awudu grew rural ghana autism movie struggles childhood journey adulthood,"Biography,Drama"
tt7842870,stolen glory tale porky brooke tells harrowing true story graeme porky brooke indigenous boxer australian sporting star,Biography
tt7659822,based nepalese politician rup chandra bista,"Biography,Drama"
tt7466770,life work carlos manuel rodrguez first caribbeanborn layperson history beatified,Biography
tt6580062,memory experimental film maker adam cooley film created lofi streamofconsciousness style works created,Biography
tt10116528,women still much likely men poor illiteratethey less assess property ownership credit training employmentthey far less likely men politically active far likely victims domestic violence seek challenge social structures male domination aim improving situation women people around within social framework subordination women men cite bright example kkrishna kumariwith strong determination intelligence insight influence managed achieve objectives innovative using tactical knowledge demonstrate first example imparting education anganwadi promoting adult education improvement vicinity implementation government health programmes pursed nursing filled wisdom wit knowledge entered politics quit complicacies faced achieving aim objectives opted anm trainingshe emphasized importance women right possibility control body reproduction decisions need gender equality order achieve goals perseverance dedication humanity care giving role patients families showing kindness compassion society awarded presidents florence nightingale awardits real life story krishna kumari,Biography
tt7317310,based life legendary finnish singer songwriter juice leskinen,"Biography,Drama"
tt8976760,mariah successful female recording artist time marriage tommy mottola turning point life began fall apart started struggle mental health,"Biography,Drama"
tt5581284,dramatised origin story one germany beloved contemporary comedians,"Biography,Comedy,Drama"
tt7581080,president nursultan nazarbayev announces transfer capital almaty akmola task almost impossible transfer capital alatau highland boundless steppes saryarka short time,"Biography,Drama"
tt6266538,story dick cheney unassuming bureaucratic washington insider quietly wielded immense power vice president george bush reshaping country globe ways still feel todaygovernor george bush texas picks dick cheney ceo halliburton co republican running mate presidential election stranger politics cheney impressive resume includes stints white house chief staff house minority whip defense secretary bush wins narrow margin cheney begins use newfound power help reshape country worldfrom yale university dropout odd jobs earlys wyoming dick cheney decides take back control life sweetheart future wife lynne cheney urgent ultimatum intern richard nixon administration cheney grabs opportunity join staff mentor donald rumsfeld takes wing paving way rise ranks white house losing job jimmy carter presidency cheney reluctantly accepts george bush proposal running mate decision would grant power pull strings foreign policy especially fateful devastating terrorist attacksthe political life dick cheney culminating vicepresidency george bush administration presented political life largely supported equally ambitious wife lynne cheney political ambitions generally hindered less charismatic demeanor politicians require succeed politics drifted right side spectrum rather moving right deliberately ideological choice elected sole house representative home state wyoming republican banner led ultimate thoughts top job white house number factors kiboshed thoughts including protect daughter mary cheney come lesbian public scrutiny reconciling support mary strong social conservative base republican party cheneys political fortunes changed dick private sector ceo halliburton asked relatively inexperienced bush running mate process dick began manipulation system benefit position eventual vp able powerful politician working quietly clandestinely behind scenes actual president continual spotlight,"Biography,Comedy,Drama"
tt5604902,true story recently widowered lawman befriends boy dying tuberculosis madam local brothel town politically violently overtaken gang reckless cattlemen texasburnt lawman mike mccluskie forced protect town deepening divide growing ohio railroad workers texas cattle men terrorizing citizens hyde park based real events mccluskie calls support local brothel owner rosie james riley young vagrant dying tuberculosis collectively transform hyde park one bloodiest violent places america,"Biography,Thriller,Western"
tt9670776,code tumas effort show wellknown events processes history eyes direct person subjective emotional look letters publicism creations juozas tumas vaizgantas also memories contemporaries make reconstruction possible,Biography
