tconst,convert_text,genres
tt3211248,ordinary man unlimited ammo stop extraordinary madman zombie army rick thorn works video game tester married love life taylor expecting first child thinks average family guy loves life nt know grandfather bourne thorn government assassin founded elite secret agent group called unexplained phenomena division upd stopped madman named maximus eldridge releasing zombie army tomb late government believes assassin blood rick body need stop maximus grandson helmut releasing zombie army rick learn wife grandmotherinlaw government agents secretly helping recruitment rick nt even believe zombies exist come grips whats happening around government train use martial arts much ammunition explosives takes become leader upd world chance survivalrick thorn thought life family comic books day thorn family untold past urged believe thought unreal pleaded become stronger ever thought rick join forces top secret agents fbi called unexplained phenomena division learn use massive amounts firepower martial arts save world evil voodoo shaman disco king helmut eldridge planning bringing great grandfather maximus back dead along zombie army take world,"Action,Comedy,Horror"
tt2829242,aj parker exhusband federal agent head ghost town mexico called paradise search hidden cache stolen double eagle gold coins,"Action,Adventure,Western"
tt10693740,zhang middle aged man struggling dead end job insurance sales person verge divorce wife losing custody daughter top take care father suffering alzheimer unknowingly zhang invited join underground fighting game financial purposes eventually zhang becomes hooked fights turns professional,"Action,Thriller"
tt10450770,young couple must overcome bitter grudge consumed hate souls tormentors reincarnated newborn twins,"Action,Drama"
tt10379122,average teenage superhero bumbleboy spends days stopping crime helping cats trees mysterious group men mysterious looking tech send bumbleboy quest prove kid things unravel bumbleboy realizes easy juggle life trying hero learn means true hero willing make sacrifices required one,Action
tt9490414,following footsteps blockbuster mojin lost legend based bestselling novel series mojin worm valley finds legendary tomb explorer hu bayi dangerous mission seeks tomb emperor xian located island monstrous creatures mystical actionadventure,"Action,Adventure,Fantasy"
tt9479454,film revolves around small police investigation rudravaram village leads solving mystery around underworld,"Action,Thriller"
tt9515914,awang gerudi tells businessman got local partner develop halal food products factory expand market business partner philipines achieve goals business various obstacles need overcome include compete businessman carry illegal business activities break rules country dream became true managed get complete gold drill,"Action,Comedy"
tt7212726,simmba corrupt officer enjoys perks immoral unethical police officer lifechanging event forces choose righteous pathsimmba orphan shivgadh beloved singham born raised contrary philosophies singham simmba believes corrupt officer life ideal life inspires become one simmba enjoys perks immoral unethical police officer twist tale transforms forces choose righteous path,"Action,Drama"
tt7652452,action thriller group filmmakers find run violent horde criminals witnessing brutal gangland execution unable flee derelict building shooting hapless film crew must use technical skill cinematic knowledge defend stunt man martial arts master special effects guru disregards safety sets lethal traps sound department strategically lay radio mics detect hoodlums way cue lots thrills cat mouse game survival,Action
tt7156436,day us presidential election ahab ha team elite mercenaries embark secret cia mission abduct north korea armed forces minister underground bunker korean demilitarized zone dmz however get caught crossfire causes tensions escalate brink world war iii,Action
tt9139664,revolves team puliscredibles consisting three charismatic adventurous police officers named jack emily popoy embark mission stop crimes occurring within vicinity,"Action,Comedy,Thriller"
tt8377564,jimmy getting married gathers buddies legendary bachelor surprisingly normal time wedding day something disturb wedding,"Action,Comedy"
tt7367960,possessed ninja doll teams teenage boy avenge murder poor child factory workeraske average boy seventh grade wants peaceful life without bothered obstacles faces daily crush girl named jessica one grade nerdy best friend oddyseus bullied boy attends special ed class named glenn aske strained relationship stepfather jrn stepbrother sune aske life turns upside one day gets ninja doll gift th birthday uncle stewart vacation thailand earlier soon finds ninja doll possessed spirit belonging japanese samurai named taiko nakamura committed ritual suicide seppuku save humanity evil doll teams aske avenge death danish businessman named phillip eberfr beat poor boy death sweatshop thailand puts aske new friendship doll test getting ready adventure aske never,"Action,Adventure,Animation"
tt7049448,desperate family exhausted avenue save gravely ill young child except one seek help form relic historianadventurer kane track buddah tooth relic believed supernatural healing powers however get buddah tooth kane must travel globe battle gauntlet warrior gatekeepers hold clues ancient relic location,Action
tt9534772,kids competing contact sports rise around world countries like united kingdom australia fullcontact mma fights kids legal whereas remain banned united states still united states kids compete brutal savage sports modified forms called muaythai kickboxing grappling pankration throughout program introduced variety matches submitted viewers around world analysis country treats sport involves kids viewer discretion advised,"Action,Sport"
tt9297624,companions lose memories sougo tokiwa sento kiryu find enemy appeared kuriogatake mountain,Action
tt4372572,outlaw terrorist organization led cleopatra mark antony julius caesar plot create new government wwiii three men stand way costs fate future humanity depending,"Action,Sci-Fi"
tt9409854,le psychologist makes money suicide prevention happiness always stems others misfortune god longevity comes earth save world power absorbed le ask le help huge plan find four gods thunder lightning wind rain living earth start adventure saving world,"Action,Adventure,Comedy"
tt7836694,slayer tested extreme forced battle powerful supernatural force ancient goddess egyptthe horrorscifi nostalgia returns egyptian artifact discovered arizona desert ancient goddess threatens unleash curse humanity slayer thing standing evil wrath nephthys survival life earth know,"Action,Horror,Sci-Fi"
tt4012916,untold story true mayan apocalypse misinterpreted scholars taken place obviously wrong secret group mexican superheroes known el trio de la luz forced destiny include adopted gringo group join fight save humanity car salesman local tv personality carry weight transform gringo green ghost shall see,"Action,Adventure,Comedy"
tt8364418,sincere cop suspended department locking horns influential people society starts taking revenge finished dear ones,"Action,Thriller"
tt7838252,set story fierce rebel rises brutal oppression becomes symbol hope legions downtrodden peoplethe movie dates back two incidents take place birth hero kolar gold fields kgf get gold hero brought poverty young goes mumbai become mafia mother wish see son rich powerful mumbai time returns back able become set people free age old slavery forms plot movie,"Action,Drama"
tt7510798,gangster maari squares beeja hardened criminal considers god death,"Action,Comedy"
tt7364086,months start see people work groups make lot zombies woods supplies hard find,"Action,Comedy,Drama"
tt9812530,huang feihong broke headquarters white lotus society guangzhou swept kanna society sumo dojo attacked directly headquarters base kanna society finally rescued zhang zhidong making great contributions counterjapanese war way,Action
tt4272776,clique teen girls led scene queen ashley begins bullying local girls get attention internet jess girl videotaping fights stand ashley bullying become victim,"Action,Drama"
tt9517188,safe peaceful town villains put behind bars thanks heroes kids going lives like children times finding difficult control powers school trip run mysterious circus performer erma mehwish hayat things start heat erma superhero parallel world running hiding babushka nimra bucha searching take away superpowers three vow protect erma even turning deenu chacha behroze sabzwari mentor gave powers first place twists follow children work selflessly greater good,"Action,Adventure,Animation"
tt9564214,claustrophobic venice lavish dress gilded interiors casanova preparing career holy orders erotic encounter sets different path,Music
tt9470272,tales tin pan alley documentary london legendary music street denmark streetbritain music street tin pan alley resided london denmark street since francis day hunter first music publishers movedin back home songwriters music venues recording studios rehearsal spaces demo studios music instruments shops well birthplace british silent cinema becoming london little tokyo world war london tin pan alley remains unparalleled people worked legendary music street take us year journey tin pan alley aided british broadcasterauthors dan cruikshank paul french joshua levene self contributors include singer dame vera lynn skiffler chas mcdevitt small faces drummer kenney jones david bowie bassist herbie flowers sex pistols bassist glen matlock damned guitarist captain sensible beta band steve mason soul singer linda lewis tom jones songwriter barry mason eurovision hit songwriter bill martin music industry legend eric hall acid jazz eddie piller guardian journalist simon usbourne among others redevelopment threatens future livelihood musicbased artisans historic street documentary concludes illustrating london losing creative hub gentrification britain birthplace popular music song tin pan alley aka denmark street remains london street musical instrument shops loss destruction areas cultural heritage naturally international concern first full length documentary highlight pressing matter,Music
tt8975850,struggling musician returns home grandfather funeral stumbles around navigating baggage old relationships,"Drama,Music"
tt8906732,behindthescenes look band chicago rehearse perform classic album chicago ii,Music
tt8887766,greatness option leaves us choice preconception birth travel mind forever man steps onto path return begins search thing resides deep within us,"Drama,Fantasy,Music"
tt8880064,shadow lands urban musicdrama streetentrenched yearold struggles learn life outside streets downandout uncle introduces music running hopes battle personal demons,"Drama,Music"
tt8819142,old music store sold vinyl records closing mumbai shweta intern online music magazine works first feature story closing store almost empty shop finds years memories old man nephew run store become subject story shweta discovers diary song lyrics vivek hidden away world shy musician finds incomplete inspires continue making songs story shop ends another story begins vivek shweta love music,"Music,Romance"
tt8788220,life story band monkees,"Biography,Drama,Music"
tt8539500,two invisible beings enchant upset life park octave guide mr pilou annabelle annabelle fascinates octave mr pilou unaware existence octave walks dog every day park master dog involved funny adventures also zo lino mme pauline caroline girl sings like angel muse music everywhere even dogs enchanted music detour leads paris paris octave remembers tango music music start unravel story scherzo visible invisible alive invisible,"Comedy,Fantasy,Music"
tt8530808,korean madonna destroys image clown,"Drama,Fantasy,Music"
tt8499816,story former famous idol looking,"Fantasy,Music,Mystery"
tt8438438,singer band struggles succeed finally writes song inspired love story lawyer catapults fame,"Drama,Music,Romance"
tt8305390,experimental road music film following gonzo journey frank lily australia search sunbathing dog features singaporebased sound project musical acts australia experimental music scene,Music
tt8036286,like bone thugs harmony best group,"Music,Reality-TV"
tt7979010,thrash bass player cover band called marsha marsha marsha nt enough girls band marsha becoming one hit wonder marsha marsha marsha breaks thrash decides going create speed metal band mock documentary follows thrash assembles speed metal band named wronger ca nt wrong wronger mock documentary details thrash assembles band photoshoot rehearsal first gig makes band superstars thrash bass player wronger sinister lead singer wronger tattoos snare drummer wronger sex addict virgin krista plays cups band peter draggon porn star thinking audition wronger guitarist audition movie mock documentary interviews lechters pipes social lubrication militant civilian fluties,"Comedy,Music"
tt7747770,raechel roslin randemann portrayed camille montgomery young female songwriter keyboard player music programmer teamed kylie westheimer waites portrayed skylar ripp actress found success child star familythemed sitcom record deal major label kylie sing songlength version popular bank jingle composed raechel kylie ambitions make deal longterm band project raechel,"Drama,Music,Musical"
tt7575520,join kibit friends dance kids favorite singalongs like old macdonald coming round mountain twinkle twinkle kids ages love dance along fun watch beavers frogs bees bunnies amazing creatures show dance skills,"Animation,Music"
tt10077620,independent feature film shot entirely gopro exclusively people love craziness,"Adventure,Comedy,Drama"
tt9511816,long autobiographical story musician scored work almost century trovajoli speaks light tone passions bach mozart love jazz music cinema musical comedies personal portrait also great lesson music cinema made artist composed unforgettable music,"Biography,Music"
tt10344086,film features songs poems performed local talent kilkenny surrounding areas showcasing landscape natural beauty home county songs written ned egan course stranger fiction life spent ireland england middle east australia back ireland,Music
tt4883336,following public fall grace country music star faith winters seeks refuge rural texas hometown rediscovers feelings high school sweetheart local pastor homecoming bittersweet,"Drama,Music,Romance"
tt9238590,hiroshi takeru tetsuo live city hiroshi unpopular idol singer feels void life placed confinement fan masako takeru believes girl returns consciousness tetsuo decides take revenge yakuza sent prison,"Drama,Music"
tt5918734,female recording artist encounters misogyny outdated business practices male record label executiveswhipsmart joyously vulgar absurdist music industry satire stadium anthems lampoons male record label executives internet age save company talent man pete barnacle agrees manufacture high gloss pop stars encounter art teacher heroine jones energizes save label industry broken,"Comedy,Drama,Music"
tt7330434,compels people confide one another chance meeting port townsend underground record shop intimate power words way future sometimes reveals past,"Comedy,Music,Romance"
tt10186696,official music joren cull aj ing days christmas project worked ten years complete,Music
tt9434772,wolve streets safe string bad luck yo money decides run plug creates drama everyday life,Music
tt7128316,old man dreams woman beach world spins around himshot year period countries awaken poetic exploration existence technology time memory executiveproduced cinema pioneers terrence mallick godfrey reggio narrated liv tyler awaken exploration earth celebration existence ode cosmos,"Drama,Music"
tt9310166,coverage annual santa claus parade performances serena ryder tenors johnny orlando,"Music,Musical,Reality-TV"
tt9203030,grammywinning singer loudon wainwright iii reflects upon unique relationship father evening original songs heartfelt stories,Music
tt10796470,one morning family goes holidays parents fighting little boy back car dreams indian toy,Music
tt8767658,los villanos blues band return cafe breton tell story blues mexico roots bringing blues streets guadalajara,Music
tt7587232,disturbingly entertaining feature debut director nicole brending dollhouse eradication female subjectivity american popular culture charts rise fall fictional child pop star junie spoons life story ensuing disasters unfold told knew set bubble gum pop world britney spears lindsay lohan told la vh behind music junie story tops one scandal another rockets international stardom faces aftermath life scrutiny losing virginity sex tape hour marriages pattyhearst style kidnapping bank heist murder mother opportunistic friends invasive paparazzi insanity bankruptcy tween idol life runs gamut voice never seen junie perspective experience seen lens stood gain success revealing hypocrisies opportunistic society preys talents contributions women dollhouse scathing look means female modern world assaulted men women media new era obsessed identity entitlement junie fall grace cautionary tale consequences denying women voice perspective,"Animation,Comedy,Music"
tt7832124,biopic turkish vocal artist mslm grses drama childhood lifeborn poor family witnessed tragedy mother baby sister getting killed father front eyes serious car accident first pronounced dead left partially deaf gave gestural speaking difficulties later became part parcel eccentric personality tumultuous relationship movie actress singer years older muslum found redemption music initial trauma lingered musical personal life internalizing grief rose ashes shattered dreams like phoenix walked darkness sang songs filled sorrow stirred people souls created cult following calling baba father first father young lowincome urban misfits rejects eccentric personality tender mournful resonant unique baritone voice unconventional vocal style lyrics conceal much real poetry raw tender became father people socioeconomic backgrounds redefined arabesque music inspired generation,"Biography,Drama,Music"
tt9140104,sonic youth concert film lance bangs,Music
tt1727824,story legendary british rock band queen lead singer freddie mercury leading famous performance live aid bohemian rhapsody footstomping celebration queen music extraordinary lead singer freddie mercury freddie defied stereotypes shattered convention become one beloved entertainers planet film traces meteoric rise band iconic songs revolutionary sound reach unparalleled success unexpected turn freddie surrounded darker influences shuns queen pursuit solo career suffered greatly without collaboration queen freddie manages reunite bandmates time live aid bravely facing recent aids diagnosis freddie leads band one greatest performances history rock music queen cements legacy continues inspire outsiders dreamers music lovers daybohemian rhapsody movie based true story queen journey start rock band nowlegendary performance live aid concert wembley stadium story chronicles lead singer freddie mercury tempestuous journey outcast immigrant struggling find place rejecting society becoming beloved worldfamous artistin london poor baggage handler heathrow airport fiercely ambitious talented indian parsi refugee farrokh bulsara sees golden opportunity lead singer local band smile decides quit incredible vocal range new name humble zanzibar boy becomes freddie mercury along guitarist brian may drummer roger taylor bassist john deacon form extremely successful british rock band queen however backdrop towering fame irrevocable bad decisions fateful aids diagnosis queen reunite nick time extraordinary twentyminute appearance london wembley stadium live aid concert,"Biography,Drama,Music"
tt6101746,rocky mountain fast guy manic depressive ride passion weirdness worry laughs pain dishonest opportunities guy montaine never seem pass high risk dreamer good ol boysongwriter talent passed daddy guy longs free family money problems plague large florida ranch good intention backfiring getting deeper hole soon becomes wanted man finds mission get songs nashville matter cost guy longs free family money problems plague large florida ranch good intention backfiring getting deeper hole soon becomes wanted man finds mission get songs nashville matter cost,"Adventure,Drama,Music"
tt8778572,upandcoming singer meets cruel reality entertainment industry must sing way surreal musical journey avoid falling abyss personal destruction,"Drama,Music,Musical"
tt8526282,need work dewey finn john ashcroft pretends friend ned earn living kicked band slacks discovers class play music creates school rock play battle bands,Music
tt6905442,lightning strike kills lead singer band resurrected electrifying special abilitiesan emerging rock band managed industry vet jimmy kleen arquette strike deal record executive rick roland wilson things take sinister turn band lead singer rachel gonino mother barb reeves struck lightning killed rachel brought back life different lightning courses veins uses new strange electrical powers drain life men turning electrifying stage performances far band willing go make,"Horror,Music,Sci-Fi"
tt4177018,vs urban rites passage drama set hostile exciting uk rap battle scene,"Drama,Music"
tt8917964,mari moving dancedrama focused mother two daughters dealing devastating gradual decline eventual passing mother grandmother mari centered tensions linger family strained relationships mari ill health brings together forcing deal issues find way time shared lossboldly combining power dance cinema mari tells lifeaffirming story professional dancer choreographer charlotte prepares new show using poetic expression dance drive narrative charlotte world turned upside discovers pregnant grandmother mari coming end life uneasy weekend family progresses charlotte mortality sinks truths women life surface charlotte driven find new meaning places previously avoided dismissed giving new perspective future wants,"Drama,Music"
tt9370424,past years sims foundation provided lifesaving mental health services austinarea musicians families organization named sims ellison bright rising star lost battle depression june th sims founded pariah one austin popular hardrock bands tragedy sims foundation born testament legendary austin music scene producers proud present special performance captured legendary austin music hall finest local stars came one evening remember sims honor organization bears name,Music
tt8696442,pop band slavabody disco disco boys announces play brazil fans group teenagers best friends gabi manu ritinha go way let parents let watch show another city,"Comedy,Family,Music"
tt5822154,life finnish singeractor olavi virtaolavi virta film alltime favorite singer finland man whose dreams interrupted war man rose poverty way top became artist dearly loved finnish people man performed stage films finally lost everything unique voice film man loved beautiful women loved beautiful women man enjoyed speed american cars applause alcohol war finnish people wanted eagerly forget bad times wanted dance party dream love olavi virta responded demand hundreds recordings evergreen songs born,"Biography,Drama,History"
tt9062342,young man charisma magnetism enters atmosphere tropical music romantic singer undertakes vertiginous ascent fame,"Biography,Drama,Music"
tt9037262,dance music theatre piece evokes world childhood careless pleasures beyond pure entertainment performance contemplates meaning importance play become adult,"Drama,Music"
tt6854672,amalie works hard fit world matters looks money dancing skills meets michael streetdancer different person metamalie works hard fit world matters looks money dancing skills father goes bankrupt life knows falls apart school amalie tries pretend like nothing happened meets michael streetdancer different person met torn new life michael constant jealousy old friends amalie finds stuck continuous web lies long keep two worlds apart dare true end,"Drama,Music,Romance"
tt6544940,lucca struggling country singer forced manager iolanda record cheesy popcountry song upon disagreement studio recording section lucca returns hometown order find inspiration music,"Drama,Music"
tt7666250,director icar bollan presents story cuban dancer carlos acosta legend dance world first black dancer perform famous ballet roles dancer want dance,"Biography,Drama,Music"
tt4768586,love enchanted young girl brings wonder healing broken familythe love enchanted young girl brings wonder healing broken family run mysterious past guided fairy see abby sparks daisy chain compassion bringing joy music back family storyteller powerful exploration reality true meaning family,"Drama,Family,Fantasy"
tt7644268,since exploding onto global stage multiplatinum tuesday night music club album onetime music teacher studio vocalist kennett missouri forged career become finest female singersongwriter generation november historic capitol theatre port chester new york sheryl crow played final night tour,Music
tt6046314,worldrenowned opera singer becomes trapped hostage situation invited perform wealthy industrialist south america,"Drama,Music,Romance"
