tconst,text,genre,titleType,primaryTitle,originalTitle,isAdult,startYear,endYear,runtimeMinutes,genres
tt8425500,"The residents of the little village called 'Schemermeer', prepare themselves for a large village festival. Vladimir, Wilko and Keelin, the members of the Nachtwacht, have extra reason to party for their friend and mentor Vega because he may finally leave his book. But the joy is of short duration because the three heroes get to hear bad news. One of them will have to leave the Nachtwacht. In the meantime, the supreme demon Nemmeza, creates nefarious plans to become the ruler of all worlds..While Schemermeer has its annual costumed party, the Nachtwacht trio awaits a delegation from the white magic high council to recharge their magical attributes. Vegal is looking forward to this rare occasion to leave his book for a few hours, and to meet his old friend, vampire count Roman, who was in the previous watch batch, with Vega's beloved Iuno. Vlad hasn't told his mates Roman is his father, and still hesitates to admit to them he's about to be decommissioned and 'promoted' to the high council, which imposed a rule no one may serve on active watch duty over 77 years, which he now reaches. Wilko had an instant dislike to the slick, handsome magician Gideon, who is to be installed as new member. But the ceremony is abused by queen of demons Nemesa, who was locked up in a mirror in the gate of souls, to unleash terrible vengeance. The bitter row among three generations of watch members now takes a backseat to warding off the demonic horde and rescuing themselves, if they can.",Fantasy,movie,Nachtwacht: De Poort der Zielen,Nachtwacht: De Poort der Zielen,0,2018,\N,88,"Family,Fantasy"
tt5304998,"A lonely desk clerk falls in love with his secretary, who happens to be a mannequin.Agalmatophilia (pronounced A-GAL-MATTO-PHILIA, is a paraphilia involving sexual attraction to a statue, doll, mannequin) is the story of Guy Talbot, an isolated workaholic who seeks a secretary to help manage his life and business. He hires his first applicant, Iesha Stayput, who oddly enough appears to be a living, breathing mannequin. She aides him in business affairs, slowly but surely, but her professionalism quickly becomes secondary to Guy's ulterior motives - Complicating matters is his vivacious client, Veronique, who swoons over Guy, perhaps as a curiously, frustrated about his lack of interest in her and obvious growing obsession with his new co-worker, who may or may not be little more than a twisted fantasy, forced into fruition. Can Guy find happiness with a moving, speaking mannequin, or will he finally fall for Veronique, who may have an odd obsession of her own?",Fantasy,movie,Agalmatophilia,Agalmatophilia,0,2018,\N,72,"Comedy,Drama,Fantasy"
tt6327784,"Tania and Daniela exchange husbands during a wedding just for fun, but a fatal accident will create new, strange relationships.Set amid the Jewish bourgeoisie of Mexico: At a friend's wedding reception, Tania and Daniela, cousins, best friends and soul mates are with their respective fiancés, chauvinistic Benny and good-natured Rodrigo. On a drunken whim the women agree to swap roles, pretending to be one another. ""I think you are mixed up,"" comments Rodrigo - and soon they are mixing it up on the dance floor, each with the other's man. They drive home with one another's partner too - but on the way, there is an accident, leaving two of the mismatched revelers dead, and the other two to pick up the pieces, as the wedding from which they just departed is soon replaced by a funeral. At this point Two Times You divides into a pair of (occasionally, irrationally overlapping) narratives, Sliding Doors-style. In one of these it is Tania and Rodrigo who survive, and in the other, Daniela and Benny. Struggling to cope with their grief, Daniela and Tania visit one another's apartments (on different floors in the same building), see each other in their memories and dreams, dress in one another's clothes, sleep in one another's beds, and are even haunted by one another's posthumous presence. Both - separately and alone - visit the building's roof where they used to spend time together, and are drawn to the edge.",Fantasy,movie,Dos Veces Tú,Dos Veces Tú,0,2018,\N,95,"Drama,Fantasy,Mystery"
tt4188180,"Four childhood friends are reunited when one of them surfaces after twenty years, forcing them to confront a creature straight out of a spine-chilling Moroccan legend.Three friends who had lost contact meet again when one of their friends, who disappeared twenty five years ago, suddenly comes back into their lives. Together, they will have to confront the terrifying events of their youth and fight a monstrous creature born from a horrible legend.",Fantasy,movie,Achoura,Achoura,0,2018,\N,90,"Fantasy,Horror,Thriller"
tt9340362,"A fantasy, soft-horror adventure in which ancient myths and legends revive thanks to a group of children who play detectives in the ancient land of Sardinia.Nicola is a boy who loves myths and old legends. One day, he pays a visit to his grandfather in a nursing home. This incident makes him decide to start a trip with the purpose to investigate on some news items that seem to be connected to the world of ancient legends. His friends Matilde, Anna and Antonio decide to go with him along this adventure, which takes them to camp in a wood near Belvì, an old village in the hinterland of Sardinia. In order to find out the cause of the strange form of anemia that has affected several newborns in town, the four children alternate nocturnal inspections and interviews with the inhabitants. Thanks to some of them, they manage to find and decipher the clues that allow them to proceed with their investigation and to learn how the elements passed on through legends and old stories can help them solving the riddle. They get to the conclusion that behind the scary cases they are studying there is an old woman who, victim of an ancient course, transforms into a blood-sucking witch known as sa sùrbile. Finally, after many turns, they manage to rescue the woman from her sad fate and to save the newborns from her menace.",Fantasy,movie,La strega di Belvì,La strega di Belvì,0,2018,\N,\N,Fantasy
tt5710532,"After an argument with her father on Christmas Eve, a little girl makes a wish to Santa for her Dad to become an Elf. The following morning, her wish comes true.",Fantasy,movie,Papa Est Devenu un Lutin,Papa Est Devenu un Lutin,0,2018,\N,74,"Comedy,Fantasy"
tt7028140,"A fairy tale, featuring the landlady Margaret, the devil Boniface, the bribable councilors Fake and Chatterbox and the lazy tailor Greasy. In Hell, the devils have a quill that writes human sins into the Book of Sins and the devils go and pull the sinners down to Helll. One day, Boniface goes on Earth, Greasy the Tailor steals the quill from him. The Devils back in Hell think nobody is sinning and everything is all topsy-turvy. Boniface admits to Margaret that he is responsible for the whole mess. Together, they not only save the town of Pytlov from destruction, but Boniface learns what true love is.",Fantasy,movie,The Magic Quill,Certí brko,0,2018,\N,\N,"Comedy,Family,Fantasy"
tt5028340,"Decades after her original visit, the magical nanny returns to help the Banks siblings and Michael's children through a difficult time in their lives.In Depression-era London, a now-grown Jane and Michael Banks, along with Michael's three children, are visited by the enigmatic Mary Poppins following a personal loss. Through her unique magical skills, and with the aid of her friend Jack, she helps the family rediscover the joy and wonder missing in their lives.Sadly, the little house on Cherry Tree Lane and the grown-up siblings, Michael and Jane Banks, are facing hard times, during the worldwide 1930s Great Slump. However--against the backdrop of a terrible tragedy and imminent foreclosure--once more, the beloved and nearly perfect nanny, Mary Poppins, descends from the skies to lend a hand. Along with the cheerfully resourceful lamplighter, Jack, the Banks are about to embark on a magical adventure--and what is more exciting--they will even get to find happiness again. Is there anything that a dash of optimism can't cure?",Fantasy,movie,Mary Poppins Returns,Mary Poppins Returns,0,2018,\N,130,"Comedy,Family,Fantasy"
tt10933674,"Sofia is a vampire who in the digital era has become a pop singer. Haunted by the ghosts of her victims, she longs for the end of curse of immortality. In the meantime, her music bewitch teenagers who see no meaning in their lives and who beg her to kill them, and transform them into internet ghosts.",Fantasy,movie,Víctima Potencial,Víctima Potencial,0,2018,\N,65,Fantasy
tt9569732,"A young girl has a difficult life living on the outskirts of Kampala with problems at home and at school. A chance encounter with a Genie changes her life when he gives her magic powers. Although she agrees that these must only be used for good purposes she quickly forgets and uses them for her own benefits and entertainment, changing as a person as time goes by. Giving up on her family and friends she learns the hard way what really is important in life.",Fantasy,movie,Jackie and the Genie,Jackie and the Genie,0,2018,\N,120,Fantasy
tt9658782,A story of Indian Bi- sexual man's parallel living.,Family,movie,Kay Bi,Kay Bi,0,2018,\N,110,Family
tt9642920,"Over 100 years' family history, full of love and freedom, struggle and choices, a history about the mysterious Tibetan land.",Family,movie,A Tale of Gyantse,A Tale of Gyantse,0,2018,\N,94,"Drama,Family"
tt9436224,A movie based on african settings,Family,movie,Emotional Blackmail,Emotional Blackmail,0,2018,\N,166,Family
tt9313816,"Set in Windhoek area in today's Namibia, The Unlikely Encounter is a drama with sarcastic humor about relational difficulties between father and son. When the womanizing and absent father, Martin Keller, sees his financial and professional universe collapse, he is also confronted with the equally fragile nature of his marital life. His wife, Joann, is a housewife who struggles to have her artistic talent recognized. In the meantime, her teenage son reacts in a rebellious way to his father's absence by deciding to ""come out of the closet"" and take the 'father's chair'. The unexpected arrival of an enigmatic uncle of Martin, Bill Keller, rekindles the hope of mending the conflicting expectations of the family triangle. The sensitive and experienced Bill, however, has its own understanding of each character's real needs and orchestrate, in his own way, an unexpected outcome. Amidst a contemporary and universal family plot, the story unfolds historical and cultural constraints rooted in the Namibian society, such as the genocide of the Herero people perpetrated by the German colonial empire, as well as highlights the importance of reconciliation.",Family,movie,The Unlikely Encounter,The Unlikely Encounter,0,2018,\N,107,"Drama,Family"
tt9284388,"Bunch of grapes is a story of a mother and daughter. It is always unique how the relationship evolves between these two women characters. The relationship between two is complicated. It is never beautiful, but it is never too toxic. Have created difficulties between the two. No mother is happy with their daughters and vise versa.",Family,movie,Bunch of Grapes,Bunch of Grapes,0,2018,\N,80,"Drama,Family"
tt9050332,A story of love and hate between brothers over a bought wife in the remote mountainous areas of China in the 90s.,Family,movie,Silent Winter,Silent Winter,0,2018,\N,94,"Drama,Family"
tt8991310,Jinmu starts to record things he should remember with a camera after hearing that he could lose his memory due to the prearranged brain surgery. Memories of family and his forgotten father comes to Jinmu's mind as he takes records of his life.,Family,movie,Tiny light,Tiny light,0,2018,\N,89,"Drama,Family"
tt8974572,A middle aged woman's the bitter tears...,Family,movie,"Woman, No Cry!","Woman, No Cry!",0,2018,\N,99,"Drama,Family"
tt8890448,"Life has become a veritable hell for Mammali, a poor barber in a remote village in Kerala and his daughter in law, Shareefa. It's after his son, Anwar joined IS and was killed while fighting for them, life went topsyturvy for Mammali and Shareefa. Life is not going to be the one they had been used to. Daily visits to the police station, harassment by law enforcers, rejection by friends and relatives, social boycott...- their life has completely changed its course. Actully they are two hapless victims ensnared in the vicious net set by communalism.",Family,movie,By Mammali an Indian,By Mammali an Indian,0,2018,\N,\N,"Drama,Family"
tt8870036,this project is a long movie (114 min) . main role of movie is Frhad- a 12-year-old living her mother and 6-year-old sister in a village call Nohooj.,Family,movie,Here,Here,0,2018,\N,114,"Drama,Family"
tt8792814,Well-meaning but naive parents get involved in seedy and illegal work in the underbelly of Tokyo to provide for their young daughter.,Family,movie,Children,Children,0,2018,\N,76,"Drama,Family"
tt8529310,Hongkongers are finding the way of life or the way of living? The city of sadness : Hong Kong.,Family,movie,"A Tiny Home, A Lead-safe Home","A Tiny Home, A Lead-safe Home",0,2018,\N,74,"Drama,Family"
tt8476138,"Tashi is a completely independent, self funded, small budget bilingual feature in English and Hindi, shot entirely in Singapore, and co-produced from Singapore and India. It is written, directed and produced by award-winning film maker Shilpa Krishnan Shukla, whose previous film ""Pularum Iniyum Naalekal"" / ""There's Always Tomorrow"" went to 33 film festivals worldwide and received 17 awards. Shilpa, who is also a full time marketing director as well as a mom, pursues filmmaking as a passionate hobby. This is her third feature film. The film was shot over the span of 8 days, by a 10-member team that included 5 cast and 5 crew, and made within a total production budget of $25K. The bulk of the post production was done virtually across Singapore and India. ""Tashi"" explores various facets of life, with a focus on the simple story telling about the delicate relationships between parents and their children, between siblings, between spouses as well as between strangers. The name of the film, Tashi, is inspired by the Tibetan word, meaning 'auspiciousness'.",Family,movie,Tashi,Tashi,0,2018,\N,93,"Drama,Family"
tt8442480,"A recently-fired columnist visits his family in Hobart and is inspired to embark on a writing project closer to the heart.COMING SOON Fired from his job writing for a weekend magazine, Ted Wilson decides to take a break from Melbourne and visit his family in Hobart. He realises his loss could be an opportunity, a chance to pursue something more meaningful. He happens on an idea: ""I want to write something beautiful about cricket. A piece of literary non-fiction. It will in some sense be about Tasmanian batsmen and it will be from the heart."" Sensing that a brush with greatness may focus his reflections, Ted embarks half-heartedly on a quixotic search for legendary Australian cricketer and exalted Tasmanian, David Boon. Yet when the search stalls, Ted finds himself immersed in a present-time of infinite riches, reconnecting with his widowed mother and adult siblings now with young children of their own. Denuded of narrative fanfare the film begins to operate as a unique documentary portrait of middle Tasmania, rare in its loving commitment to a warm and convivial present. Featuring remarkable performances from a cast comprised solely of the director's immediate family, UNDER THE COVER OF CLOUD discovers a uniquely Australian tranquillity, drawing attention throughout to the grace of what is so often hidden in plain sight.",Family,movie,Under the Cover of Cloud,Under the Cover of Cloud,0,2018,\N,88,"Drama,Family"
tt8320292,"The film is about under the background of great migration and urbanization in China, this film focuses on the troubles in migrant workers' life due to household registration system. Because of the household registration system, although the Chinese government allows people in rural or poor areas to move to developed or large and medium-sized cities, the migrants actually have not been treated fairly as their children cannot even study in the city where they work.And their schools were demolished, they were expelled from the big cities.",Family,movie,Expelling,Expelling,0,2018,\N,82,"Drama,Family"
tt8152842,"Two schoolgirls volunteer at a local radio station that is a glue for the community. Ryuji and Natsuo have arrived in town to manage the station. They are looking for local stories, content and programming when they hear that a festival called Yamaage has encountered problems. They and the two schoolgirls are involved in helping the situation.",Family,movie,Youtachi Happy Eigaban Himawari,Youtachi Happy Eigaban Himawari,0,2018,\N,\N,Family
tt8123800,"Religion came into being to build a harmonious society. Ancient Hindu religion, the oldest of all is not initiated by one person but implored a way of life exploring betterment of the community. The scriptures, mantr(the chants) & rituals have a strong scientific base, meaning & understanding of which is losing its luster over the years. Today's youth going global is confused about this basic faith, God is not an entity but the positive energy with'in' & demon is the negative energy with'out'. Hindu religion is based on 5 basic natural energies, Sun, wind, rain, earth & space of which every living being is made of. Chaos & confusion in the minds of Today's youth devoid him of the concrete strength of life, This film creates a story interwoven with such simple day to day life characters which try to simplify the complexities of religion. Religion if understood in right perspective develops the individual, mass & societal mind simultaneously, but that's what is lost as it is being superficially politicized-used for selfish gains. No religion can ever preach destruction of mankind... it's the no or low understanding of the executors & followers who see the Religion with incorrect perspective. Religion initiates such strength in every single human outreaching the entire society building plane harmony. From with'in' to with'out' is its journey. So let today's youth understand clearly the simplicity of it & how it binds each one of us to have that collective strength.",Family,movie,MANTR: A Positive Vibration,MANTR: A Positive Vibration,0,2018,\N,78,"Drama,Family"
tt7813894,Five individuals struggling to achieve their dreams in a Future City.,Family,movie,Zaraab,Zaraab,0,2018,\N,60,"Drama,Family"
tt7421782,"Children want to become elders soon, so that they can do or eat whatever they want, but parents wish their children to be disciplined and well mannered. Parents decide to leave the town so that children be the way they want. Children enjoy the freedom of being like elders but end of the day they start missing their parents. On the other side parents are seen worried and concerned and are sticking to their secession. How children convince their parents to come back and further how they live happily is VERY GOOD.",Family,movie,Very Good,Very Good,0,2018,\N,\N,Family
tt7285388,"Seven-year-old Kayla's father dies unexpectedly on a mission in the U.S which changes Kayla's life completely. She takes on the responsibility of her broken family. She inspires the people around her with love and singing. And in the end, she manages to carve out a happy life.",Family,movie,Kayla,Kayla,0,2018,\N,\N,"Drama,Family"
tt7194914,"When an unexpected injury forces Jesse out of work, facing financial crisis and mental anguish, the family must stand together.",Family,movie,Silver Dollar Fish,Silver Dollar Fish,0,2018,\N,\N,"Drama,Family"
tt7131338,"When an emotionally broken family moves into a house haunted by Tom, a suffering spirit, Tom sees an opportunity to try and save his soul by teaching the family how to live again...but quickly discovers that is easier said than done.When drunken and depressed divorcee Tom falls over his second-story banister to his death, he unknowingly awakens in the afterlife to find things haven't changed too much - that is, until Angie, a District Ghost Manager, arrives and rules Tom's death a suicide. Tom is told he will have to remain in his home until the date of his ghost trial to determine if he will be sent to heaven or hell. The kicker comes when Angie tells him that things don't look good for his redemption because good and bad marks have been kept on him since he was born, and he is running a major deficit. One thing that gives Tom hope, though, is that the accounting of the good and the bad continues in the afterlife, all the way up until his trial.",Family,movie,Ghost in the Family,Ghost in the Family,0,2018,\N,100,"Comedy,Family"
tt7006612,"MAYBELINE a divorced woman, struggling to find herself, discovers her only sister SHARON (mother of 3 young boys), is terminally ill. MAYBELINE's life is turn upside down, as she takes on a role she never anticipated, fighting to save herself and the 3 young boys.",Family,movie,My 3 Boys,My 3 Boys,0,2018,\N,\N,"Drama,Family"
tt6812842,"Dheblu carrying the burdens of her dead husband along with her daughter Pokchi, are on their final journey to the mountains of Uribo. Alongside the story of Putum, a 9 year old earthquake survivor on a quest to find her lost family back.The journey of Dheblu and her daughter Pokchi to the mountains of Uribo, carrying the burdens of her dead husband. Alongside the story of Putum, an adopted 9 year old earthquake survivor trying to find her real family back.",Family,movie,Will fly,Will fly,0,2018,\N,66,"Drama,Family"
tt5072612,"David McDoll is a selfish and wealthy man living an enviable lifestyle in his large villa and collecting fancy cars. However, his life is about to be changed forever when he inherits his six grandchildren. His glamorous lifestyle quickly becomes complete chaos. But he will learn a valuable lesson that teaches him about placing family first and discovering a newfound appreciation for life.",Family,movie,6 Children & 1 Grandfather,Six Children and One Grandfather,0,2018,\N,105,"Comedy,Family"
tt4718534,"After a vicious assault, a woman holds the fate of her attacker in her hands.",Family,movie,He Watches Over Me,He Watches Over Me,0,2018,\N,87,"Drama,Family"
tt4212984,"Jimmy is a 12 year-old boy who daydreams about being the world's greatest animal trainer. Unfortunately, after the loss of his father, his daydreams take over, and his school and personal life begin to suffer. That is until his mom sends him to live with his grandfather for the summer. Just when he thinks things have gone from bad to worse, he discovers an animal sanctuary next door, and a baby white lion. But when he learns that the sanctuary is about to be bought by an evil corporation that plans to use the animals for testing, he formulates a plan with his new found friends to stop the sale, and expose the company for what they're really doing.",Family,movie,Jimmy's Jungle,Jimmy's Jungle,0,2018,\N,100,Family
tt3380190,EK THA HERO is an inspiring story of a 11 year old village boy fondly called as HERO who has a passion for CYCLE & dreams of having his own CYCLE someday. He has to go through a roller coaster ride to make his DREAM COME TRUE. He does not succumb to his failures & sets a strong example of NEVER GIVE UP & emerges out to be a real HERO.,Family,movie,Ek Tha Hero,Ek Tha Hero,0,2018,\N,121,"Drama,Family"
tt3101140,"Inspired by true events and shot on location in New Orleans, LA. GEMMA BROWN and MARNI WILKINS and their families have been best friends since they were babies. At five, when Marni lost her mother, she was left with an unfulfilled soul. It was a devastating loss, but thankfully her best friend, Gemma and her family were always by her side. Now ten years later, Marni has the opportunity to find that lost connection with her mother when she learns that her mother's favorite poet, SAMANTHA BANKS will be teaching at a distinguished magnet school for the arts in their area. The two friends are both excited to apply. Gemma gets accepted, however they soon learn that Marni's father has neglectfully missed the registration deadline. Realizing that her dreams of getting to know her mother may disappear, Gemma convinces Marni to do something drastic. Things don't go as quite planned, but the two girls learn a valuable lesson about race, identity, politics, friendship and growing up in this poignant, yet tender, 'coming of age' story.",Family,movie,My B.F.F.,My B.F.F.,0,2018,\N,\N,Family
tt2319991,"One man's struggles with drug addiction told through the eyes of the person he loves most, his little sister.",Family,movie,The Original Play James Play,The Original Play James Play,0,2018,\N,110,"Drama,Family"
