tconst,text,genre,titleType,primaryTitle,originalTitle,isAdult,startYear,endYear,runtimeMinutes,genres
tt4633694,"Teen Miles Morales becomes Spider-Man of his reality, crossing his path with five counterparts from other dimensions to stop a threat for all realities.Miles Morales is a New York teen struggling with school, friends and, on top of that, being the new Spider-Man. When he comes across Peter Parker, the erstwhile saviour of New York, in the multiverse, Miles must train to become the new protector of his city.Phil Lord and Christopher Miller, the creative minds behind The Lego Movie and 21 Jump Street, bring their unique talents to a fresh vision of a different Spider-Man Universe, with a groundbreaking visual style that's the first of its kind. ""Spider-Man(TM): Into the Spider-Verse"" introduces Brooklyn teen Miles Morales (Shameik Moore), and the limitless possibilities of the Spider-Verse, where more than one can wear the mask.Miles Morales is a teen from Brooklyn, struggling with own issues as he adjusts to a new school. On top of that, he must carry the mantel of being Spider-Man, as he meets various different versions of the iconic superhero in different forms, from different dimensions across the universe.Peter Parker is the only Spider-Man, except there are other Spider-Men out there: in the multiverse known as 'The Spider-Verse'. After down-on-his-luck teenager Miles Morales gets bitten by a radioactive spider, he sees Spider-Man stop the Kingpin's dimension-crossing super-collider; only to be killed by the Kingpin afterwards. Seeing his hero die before him, Miles vows to avenge the wall-crawler and destroy the collider once and for all. Unknown to Morales, there's another Peter Parker from another dimension.",Sci-Fi,movie,Spider-Man: Into the Spider-Verse,Spider-Man: Into the Spider-Verse,0,2018,\N,117,"Action,Adventure,Animation"
tt1571234,"In a post-apocalyptic world where cities ride on wheels and consume each other to survive, two people meet in London and try to stop a conspiracy.A mysterious young woman, Hester Shaw, emerges as the only one who can stop a giant, predator city on wheels devouring everything in its path. Feral, and fiercely driven by the memory of her mother, Hester joins forces with Tom Natsworthy, an outcast from London, along with Anna Fang, a dangerous outlaw with a bounty on her head.Thousands of years after civilization was destroyed by a cataclysmic event, humankind has adapted and a new way of living has evolved. Gigantic moving cities now roam the Earth, ruthlessly preying upon smaller traction towns. Tom Natsworthy (Robert Sheehan)-who hails from a Lower Tier of the great traction city of London-finds himself fighting for his own survival after he encounters the dangerous fugitive Hester Shaw (Hera Hilmar). Two opposites, whose paths should never have crossed, forge an unlikely alliance that is destined to change the course of the future.Based on the Bestselling book by Philip Reeve, Mortal Engines tells the story of a dystopian future, where cities move on wheels across a barren earth. One day on London, a young, scarred girl named Hester Shaw meets with a boy named Tom Natsworthy, an outcast from London, and accompanied by the brave Anti-Traction League, must stop the villainous Valentine and an unfolding plot to destroy the world.",Sci-Fi,movie,Mortal Engines,Mortal Engines,0,2018,\N,128,"Action,Adventure,Fantasy"
tt4701182,"On the run in the year 1987, Bumblebee finds refuge in a junkyard in a small California beach town. On the cusp of turning 18 and trying to find her place in the world, Charlie Watson discovers Bumblebee, battle-scarred and broken.On Cybertron, the Autobots, led by Optimus Prime, are on the verge of losing the Great Cybertronian War to their enemies, the Decepticons, and begin making preparations to leave the planet. The Decepticons led by Shockwave, Soundwave and Starscream ambush them during the evacuation, and Optimus sends a young scout, B-127, to Earth in order to set up a base of operations where the Autobots can regroup. B-127 reaches Earth alone in 1987, crash-landing in California and disrupting a training exercise being conducted by Sector 7, a secret government agency that monitors extraterrestrial activity on Earth. Sector 7 agent Colonel Jack Burns presumes B-127 to be a hostile invader and attacks, driving B-127 into the forest, where he is then ambushed by the Decepticon Blitzwing. When B-127 refuses to reveal Optimus' whereabouts, Blitzwing spitefully tears out his voice-box and damages his memory core. B-127 manages to destroy Blitzwing before collapsing from his wounds. Before entering stasis, B-127 scans and transforms into a yellow 1967 Volkswagen Beetle.After being defeated by the Decepticons in the war on Cybertron, the Autobot leader Optimus Prime sends B-127 to Earth to establish an outpost and protect Earth. B-127 surprises the training of a group of soldiers under the command of Colonel Jack Burns and escapes. However, he is ambushed by a Deception that damages his memory core and voice-box. But B-127 defeats the enemy and transforms into a yellow 1967 Volkswagen Beetle. In 1987, the eighteen-year-old Charlie Watson finds the Beetle in a junkyard and the owner Hank gives the car to her. The teenager is a great mechanic that misses her father and lives with her young brother and her estranged mother and her boyfriend. Charlie accidentally activates a signal and the Decepticons track down B-127 on Earth. Two Decepticons head for Earth to capture and destroy the Autobot convincing Dr. Powell and the army that they are peaceful and the enemy is a dangerous robot. Meanwhile, Charlie befriends B-127 and calls him Bumblebee.",Sci-Fi,movie,Bumblebee,Bumblebee,0,2018,\N,114,"Action,Adventure,Sci-Fi"
tt9377748,"Virginia lives on her own in a house in the outskirts of the city and finds out Monica, and old friend who she hasn't seen in a long time. Virginia is a scientist but now works in a laboratory that she has set up in her own house because she has been dismissed from her job in a public center of research. Nonetheless, whats she actually wants is to use Monica as a volunteer for her secret experiment to contact with other - dimensional beings.",Sci-Fi,movie,Monica en Trance,Monica en Trance,0,2018,\N,75,Sci-Fi
tt8390370,"RADIO SILENCE A select team of U.S. Army Special Forces Soldiers are sent on a mission to retrieve pieces of a downed U.S. spy satellite from a remote desert region of northern, Mexico. They are excepting a routine, even boring on a mission, asking only ""on a Sunday, sir?"". What they encounter is the sudden loss of half their team, their Mexican escorts and nearly all of their equipment. They are forced to retreat on foot and spend a long night hiding in a local restaurant trying to understand what they are up against and how to survive with no gear, no support and no time.",Sci-Fi,movie,Radio Silence,Radio Silence,0,2018,\N,120,Sci-Fi
tt8318702,Passengers on a train that crashes into a river must decide whether to risk waiting for help in the wreckage or take their chances in the murky depths below.,Sci-Fi,movie,D-Railed,D-Railed,0,2018,\N,90,"Action,Adventure,Horror"
tt8041916,"When a young man finds a time machine device, his life spins out of control.",Sci-Fi,movie,Time Jumpers,Time Jumpers,0,2018,\N,79,Sci-Fi
tt4418730,"When Natalie's boyfriend is murdered, she builds a machine to change the past by changing her own memories. An FBI agent, her sister and her therapist all try to stop her before she hurts herself, but there's no use. She'll do anything to get him back.",Sci-Fi,movie,As It's Remembered,As It's Remembered,0,2018,\N,75,"Drama,Sci-Fi,Thriller"
tt9497146,"One year has passed since the events of Mobile Suit Gundam Unicorn and the Laplace's Box was opened. Following the conflict called the ""Laplace Incident"", the Neo Zeon remnant force known as the Sleeves is destroyed. Both the Banshee and Unicorn Gundam are sealed away from public consciousness, locked in secrecy and meant to be forgotten by history. However, sightings of another Gundam are suddenly being reported. The Unicorn Gundam 03 Phenex, thought to be lost since two years ago, has reappeared.",Sci-Fi,movie,Mobile Suit Gundam Narrative,Mobile Suit Gundam Narrative,0,2018,\N,88,"Action,Animation,Sci-Fi"
tt9290986,"A C.I.A. agent participates in a secretive brain-transference program when the ambassador to Italy is kidnapped by a rogue agent.When the American ambassador to Italy is kidnapped, a rogue U.S. government agent makes demands that send the President and the C.I.A. scrambling to protect a mysterious covert government project involving memory transference. With his brain recently scanned into a hard drive, the ambassador's knowledge of all international undercover agents becomes a hot commodity on the black market and only one scientist has the know-how to implant that data into another host. With a plethora of double agents in the mix, the C.I.A. dispatches Agent John Ramsay to find and secure the scientist. But, knowing who to trust becomes virtually impossible as corruption and treachery trickle down from the highest levels in this pulse-pounding spy thriller.",Sci-Fi,movie,The Infinity Project,The Infinity Project,0,2018,\N,86,"Action,Sci-Fi,Thriller"
tt7978752,A suicidal businessman is visited by an inter-dimensional being who appears in the form of a beautiful woman.,Sci-Fi,movie,The Bestowal,The Bestowal,0,2018,\N,90,"Drama,Fantasy,Sci-Fi"
tt8115684,"A privately-funded 1960 expedition seeks to beat both the U.S. and the Soviet Union in the race to Mars. But what the intrepid explorers discover - changes everything. This film is a tribute to, as well as a send-up of, Classic Sci-Fi. The satirical references come thick and fast. But there's also a more serious message woven in.",Sci-Fi,movie,Journey to the Docile Pink Planet,Journey to the Docile Pink Planet,0,2018,\N,100,"Adventure,Sci-Fi"
tt5080556,"Dr Vaseegaran (Rajinikanth) and his android assistant Nila (Amy Jackson) are called in for help after mobiles start mysteriously flying out of the hands of people in Chennai. Vaseegaran summons his trusted robot Chitti (Rajinikanth) to ward off the bird-shaped supernatural powers of Pakshirajan (Akshay Kumar).8 years after Chitti was dismantled due to destruction he caused. Vaseegaran has created new human robot Nila which can understand human feelings better. The cell phones in the city start to disappear from everywhere. A creature in the form of bird creates havoc in the city causing destruction. Vaseegaran believes it to be the fifth element force and decides to get Chitti back in action. When Vaseegaran traces the location of missing cellphones with help of Chitti and Nila he finds that its not the fifth force but a human force done by late professor Pakshi Rajan.When mobile phones start mysteriously flying out of the hands of people in Chennai, Dr Vaseegaran and his android assistant Nila are called in for help. The city is under a threat from the supernatural powers of Pakshirajan, a deadly winged monster seeking revenge on mankind for harming birds with mobile radiation. Dr. Vaseegaran is forced to reassemble his robot 2.0, the upgraded version of Chitti to fight against Pakshirajan and save the world.",Sci-Fi,movie,2.0,2.0,0,2018,\N,148,"Action,Sci-Fi"
tt9442046,Third installment in the Kerion sci-fi saga. New Dawn sees the rebellion take a stand against the Empire.,Sci-Fi,movie,New Dawn,New Dawn,0,2018,\N,\N,Sci-Fi
tt9034308,"A desperate wife agrees to have a baby cloned from her comatose husband's DNA. However, the husband gets better and they get rid of the baby - until the past comes calling decades later in a mix of mystery, lust and violence.Josie, a devoted wife, is devastated when her beloved husband, Leo, falls into a coma after a terrible accident. Desperate to have his child, she accepts her only option: cloning. The arrival of the baby unexpectedly awakens Leo, unleashing in him a newfound ability to experience supernatural visions. These visions weaken him and reveal a terrible, cursed future which he cannot understand or accept. Confused and intensely anxious by what she's done, Josie tries to deny what she's created, but her husband's reactions grow stronger to the baby. She confronts the doctor who spearheaded the experiment fearful that the man and his clone cannot coexist - but the baby is too great a danger. Leo and Josie are forced to make an impossible choice and keep a secret forever. The couple remain together, their love continuing, his career thriving. But twenty years later their past comes back to haunt them. The truth cannot be buried. Patient 001 is a dark, twisted, Gothic fairy tale for grown ups.",Sci-Fi,movie,Patient 001,Patient 001,0,2018,\N,87,"Horror,Sci-Fi,Thriller"
tt1780790,"A camping trip turns into a living nightmare when a blizzard traps four friends in 36 inches of sudden snow -- and shrieking alien sounds outside of their tents.A camping trip turns into a living nightmare when a blizzard traps four friends in 36 inches of sudden snow - And shrieking alien sounds outside of their tents. A race for life ensues as they are hunted by horrific monsters, discovering a larger alien conspiracy with every terrifying stride.",Sci-Fi,movie,Catskill Park,Catskill Park,0,2018,\N,93,"Horror,Sci-Fi,Thriller"
tt1477834,"Arthur Curry, the human-born heir to the underwater kingdom of Atlantis, goes on a quest to prevent a war between the worlds of ocean and land.Arthur Curry, half human half from Atlantis, goes on a trip of a lifetime. Not only does this adventure compel him to come to terms with his real identity, but it also forces him to discover whether he is entirely worthy of fulfilling his own destiny: becoming a king.Born upon the shores of the surface world, Arthur Curry discovers that he is only half human with the other half of his blood being of Atlanteean descent, thus making him the rightful heir to the throne of the undersea kingdom of Atlantis. However, Arthur learns that Atlantis is being ruled by his malicious half brother Orm, who seeks to unite the seven underwater kingdoms and wage war upon the surface. With aid from Nuidis Vulko and the gorgeous Mera, Arthur must discover the full potential of his true destiny and become Aquaman in order to save Atlantis and the surface from Orm's evil plot.Arthur Curry has always been different. His mother was an honorable queen of atlantean descent, while his father, a simple human lighthouse keeper. They met after she fled to land, running from her forced fiancée. A few years later, Arthur is a toddler, when his mother was forcefully and reluctantly taken back to Atlantis, where she was believed to be executed. Fast forward and Arthur is now an adult. After learning the truth about his destiny, he sets out to find a king's lost trident and stop an entire war before it even starts.",Sci-Fi,movie,Aquaman,Aquaman,0,2018,\N,143,"Action,Adventure,Fantasy"
tt9318706,A young Greek photographer boards and an elevator of a very very very very tall building and goes up.,Sci-Fi,movie,Elevator to Insanity,Elevator to Insanity,0,2018,\N,72,"Horror,Mystery,Sci-Fi"
tt9341628,"As mass of solar storms causes tsunamis, volcanoes, and flooding, a city-dwelling family attempts to flee to the relative safety of a group of high-elevation caves several miles away.",Sci-Fi,movie,End of the World,End of the World,0,2018,\N,88,"Action,Adventure,Drama"
tt7033092,"In a not so distant future, countries are recovering from World War III. Civilians from all over migrate to other countries to claim new land. 5 infants are born in one of the towns, that will forever change the course of time.",Sci-Fi,movie,The Five in Merseyside,The Five in Merseyside,0,2018,\N,60,"Horror,Sci-Fi"
tt8241148,"Dive deep into a dystopian inner-world where grown men crawl around on all fours and chaos reigns supreme.A man named Bobo is haunted by a demon claiming to have possession of his deceased son's soul, and a boy named Andrew lands a job as the host of a new conspiracy theory web series. Also, a small karate man travels deep into the underworld to battle true evil.",Sci-Fi,movie,Dagko na Tawo,Dagko na Tawo,0,2018,\N,320,"Drama,Horror,Mystery"
tt3833682,"A hermit farmer discovers his late father's secret journal containing plans to a magnetic powered machine that could change the world, while unexpectedly becoming custodian of his gifted 6 year old nephew, after his mom's untimely death.Grady Lee Jr. is a struggling reclusive farmer who has never wanted to be married or have children. He lost his mom when he was a young boy and by the time he was 13, his father and step-mom died in a car wreck separating him from his stepsister, Marry Ann. Randy, his father's best friend, took Grady in and raised him as his own and kept the family farm sustained. One day, Grady discovers his late father's hidden journal That contained secrets of Nikola Tesla. The journal contains the plans to a machine that works off of electro-magnetism, called Jack. Grady believes it could increase productivity by drastically reducing the time it takes a plant to grow. This could be the answer to saving his farm and helping the county, when in fact this could change the world. With the help of his friend, Boudreaux, they begin to work on the device. Boudreaux, of Native American decent, can sense a change is coming for Grady's. After a call from an attorney, Grady finds himself a beneficiary to his late step sister's last will and testament, just to discover he is custodian to his nephew, a special 6 year old boy, Kai. Those that meet Kai are drawn to him, all except for Grady. The child is a distraction he would rather not have, and keeps him from Jack, and his heart. Being from the city, Kai is a stranger to nature, but, his mom remembered the farm and believed that it would make the perfect environment for his ability to be nurtured and for Grady to discover his familial emotions once again.",Sci-Fi,movie,Tinker',Tinker',0,2018,\N,97,"Drama,Family,Sci-Fi"
tt1458902,A family man struggling to hold it all together discovers a hidden parlor that offers a solution...sexbots.,Sci-Fi,movie,2050,2050,0,2018,\N,104,"Drama,Fantasy,Sci-Fi"
tt8282980,"Taking place in the fifth reality to be discovered by humanity, Into The Alternate follows an inhabitant and foreign visitor as they struggle to survive within a collapsing ecosystem.An abstract exploration of 21st century domesticity through the eyes of a foreign documentarian, the film takes a journey into the goings-on of a peculiar other world. An unnervingly familiar environment begins to unravel itself in this avant-garde meets nature documentary story of adaptation and survival.",Sci-Fi,movie,Into the Alternate,Into the Alternate,0,2018,\N,78,Sci-Fi
tt9192492,"In a pile of dead bodies, someone wakes up. Who is he? How did he end up there? Amnesia is the first stage of an infection that turns humans into dried husks of flesh. Hunger led them to eat corpses from the bacteriological war of the North, thrown from the sky to the South of the Latin American continent. Dog - the name given him by three wild men and a young girl - begins an insane and bloody race to survive.",Sci-Fi,movie,I Am Toxic,Soy tóxico,0,2018,\N,76,"Action,Horror,Sci-Fi"
tt7961060,"Goku and Vegeta encounter Broly, a Saiyan warrior unlike any fighter they've faced before.",Sci-Fi,movie,Dragon Ball Super: Broly,Doragon bôru chô: Burorî,0,2018,\N,100,"Action,Adventure,Animation"
tt9752158,A man is appointed pastor of a church that needs God.,History,movie,Appointed - The Story of George H. Murray,Appointed - The Story of George H. Murray,0,2018,\N,90,"Biography,Drama,History"
tt9376096,"August 15, 1945 World War II, the story of 9 people gathered at a place in Korea's Gunsan Harbor, where Japan was occupied the day before Japan surrenders to the United States",History,movie,The Destiny of Pigs.,The Destiny of Pigs.,0,2018,\N,102,"Drama,Fantasy,History"
tt8991324,"'Lihaaf' ('The Quilt') is a 1942 Urdu short story written by Ismat Chughtai. Published in the Urdu literary journal Adab-i-Latif, it led to much controversy, uproar and an obscenity trial, where Ismat had to defend herself in the Lahore Court as well for this work. She was asked to apologize which she did not and also won the case, after her lawyer pointed out that the story makes no suggestion to a sexual act, and prosecution witnesses could not point out any obscene words, and the story is suggestive and told from perspective of a small girl. In the coming decades it was widely anthologised, and became one of her most known works, besides Angarey which remained banned for several decades. Years later, she mentioned in detail the court trial in her noted memoir, Kaghazi Hai Pairahan (A Life in Words: Memoir).Though it received attention for its suggestion of lesbianism, it also deals with the insulated and suffocating life of a neglected wife in the feudal society. It became a landmark for its early depiction of sex, still a taboo in modern Indian literature, let alone Urdu literature. The film is adaptation of the story 'Lihaaf' and about author's real life experience of three years of fighting a court case against her challenging her freedom of speech.",History,movie,The Quilt,The Quilt,0,2018,\N,80,"Biography,Drama,History"
tt8979816,"In the mid 16th century, classical East Bengal context - after being betrayed by her fiancé - the young female writer Chandrabati exiles herself inside a Shiva Temple and resorts to re-write the great Indian epic `Ramayana', rebelliously establishing ignored point of view of Sita- diminishing the iconic hero of the epic Rama.",History,movie,The Tales of Chandrabati,The Tales of Chandrabati,0,2018,\N,105,"Drama,History"
tt8841550,"A dramatised documentary starring Rachel Griffiths and Oscar Redding that examines the lives of two people, Etty Hillesum and Franz Jaegerstaetter, who both stood their ground against the Nazi oppressors in Europe in 1943 and suffered with their lives.",History,movie,Strangers to the World,Strangers to the World,0,2018,\N,\N,History
tt8785080,"From spring 1941 to summer 1942, nearly 80,000 Jews were rounded up in France and deported. Almost all will die in concentration or extermination camps. Without the assistance of the French authorities and police, these operations meticulously prepared by the Nazis would never have existed. Thanks to realistic evocative scenes, archives and photographs for some unpublished, this documentary plunges into the last elements revealed by historical research to make us live, from the inside, these waves of massive and violent arrests.",History,movie,"The Shoah in France, turning point of 1942","The Shoah in France, turning point of 1942",0,2018,\N,\N,History
tt8781530,"Often told by the students or politicians' point of view, but more rarely from the police perspective. Using archive documents obtained by derogation from the statutory limitation period of 60 years, but also thanks to testimonies of officers working during this point in history, this factual documentary offers a different reading of May 68. That of policemen plunged in the midst of an unexpected, violent tumult.",History,movie,May'68: as witnessed by the police,May'68: as witnessed by the police,0,2018,\N,\N,History
tt8685584,No one don't like home cookin,History,movie,Home Cookin: 5.17.18,Home Cookin: 5.17.18,0,2018,\N,98,"Biography,Comedy,Family"
tt8485448,This times it is not about Freedom of Speech but Freedom of Thought.,History,movie,Touttay,Touttay,0,2018,\N,52,"Drama,History"
tt6693892,A wayward youth is given a life changing lesson as his centenarian great grandfather takes him on a sojourn to the civil war south and their families roots.A wayward young man begins his journey to redemption through the guidance of his centenarian great grandfather. A sojourn walking in the footsteps of the family progenitor known as the' Man Without a Name' awakens the youth. The two men juxtaposed on a literal path of life come to grips how the dark shadows of the Confederacy still loom in the 21st Century for Afrikans in America.,History,movie,Blood Freedom: Unchained Rebellion,Blood Freedom: Unchained Rebellion,0,2018,\N,45,"Drama,History"
tt5605556,"In the mid-20th century, a lesbian estranged by her family struggles to get them back by falsely adopting the faith of a Christian household where she takes shelter, but finds herself infatuated with their daughter.In the mid-twentieth century, Alice Mitchell works as a prostitute on the street. After her situation worsens, she unsuccessfully attempts to reconcile with her estranged family over her homosexuality. She takes shelter at a Christian household and wins them over by falsely adopting their faith, despite opposition from their in-law, Lillian. While there, Alice's infatuation with the family's daughter, Annabel, grows. After Lillian reveals Alice's homosexuality, Alice redoubles her efforts to rid herself of it to no avail as she succumbs to a relationship with Annabel. Their relationship is discovered. In desperation, Alice commits to faith instead and starts a relationship with a man, reconciling her with her parents. But she falters when confronted by Annabel again, struggling to decide between leaving with her and remaining with her own family. Through a final confrontation with Lillian, Alice makes her final choice.",History,movie,Nothing Like the Sun,Nothing Like the Sun,0,2018,\N,98,"Drama,History"
